ID_GodotObject,cluster_value,merged_text
2000116371728,3,﻿20_Coronavirus Sonderbeauftragter Clemens Auer italienisch spanisch Verhältnis vermeiden Coronavirus-sonderbeauftragter-clemens-auer-italienische-oder-spanische-verhaeltnisse-vermeidenmaskenpflicht mehr Testunge coronavirus-verbreitung Clemens Auer Gesundheitsministerium Chat Gast seit Mittwoch Österreich Supermärkt Gesichtsmasken verteilen Maßnahme Clemens Martin Auer Sonderbeauftragter Gesundheitsministerium Rolle Berater Gesundheitsminister_Rudolf_anschober_grün begrüßen Sinn Zweck Übung ja Person potenziell Ausstoß Tröpfche mund- nasenbereich minimieren sodass Tröpfche Person gelangen beantworten entsprechend Frage users Auer werden Mittwoch standard-chat Kritik konfrontieren etwa Frage warum wenig testen Österreich heutig Tag 80000 Test durchführen wobei international Vergleich oberer Drittel Land liegen teste derzeit Person Symptom beginnen repräsentativ Testunge Bevölkerung einzelner Berufsgruppe vornehmen Test billig eingesetzt Euro gut investieren Klarheit Entwicklung Pandemie bekommen Auer coronavirus-pandemie anfangs Ernst genug nehmen werden weisen Experte zurück lang beruflich karriere nie erleben zuständig sindheitsbehörden allermeister Land rasch neu aufgetretenes Virus reagieren Maßnahmenpaket Regierung verteidigen Auer sein Ziel Schule Unternehmen Monat hinweg schließen halten müssen Neuinfektionsrate Beginn Pandemie flach halten stationär Einrichtung besonders stark erkranken ähnlich dramatisch verhältnissen Italien Spanien kommen diktatorisch Mittel Entscheidungsfindung Krisenstäb Erfolg hoch ethisch Bewusstsein Abwägung richtig falsch Auer schaffen Maßnahme setzen diktatorisch Mittel greifen müssen Zusammenarbeit Bundesland bezeichnen gelingen verantwortlich gemeinsam vorbildlich eventualitäen vorbereiten Sache Entwicklung impfstoff glauben Auer Geduld Tag legen müssen Weltgesundheitsorganisation who gehen davon impfstoff realistischerweis Jahr Verfügung stehen verhalten medikamenten Therapie impfstoffen vorliegen schließlich geben Auer Entwarnung Übertragung Virus Papier Kartonag bzw Essenszusteller betreffen Literatur unbekannt Virus Kartonag weiterverbreiten daher unbedenklich Pizzakarton angreifen sicher waschen gründlich Hand Rosa winkler-hermaden 142020 Standard Hendrich Standardcorn | Sonderbeauftragter Clemens Auer italienisch spanisch Verhältnis vermeiden
2000116717900,3,﻿20_Coronavirus Paznaun st Anton bleiben quarantäne fast fünfter freiwillig Test Positivcoronavirus-paznaun-und-st-anton-bleiben-unter-quarantaene-fast-jeder-fuenfte-bei-freiwilligen-tests-positivdie Zahl infiziert ganz Österreich bewegen 95-prozentiger Wahrscheinlichkeit Anfang April 10200 67400 Ergebnis sora-studie wichtig_kürzen Tiroler Paznauntal st Anton Arlberg weit zwei Woche -- 26 April -- quarantäne bleiben Schwerpunktmäßige Testunge 19 Prozent Ergebnis positiv rund 3000 Test vergangen Tag Freiwilliger Basis quarantänegebieen durchführen werden hoch Anzahl positiv Ergebnis sein erwarten rund Drittel Person leicht Symptom lassen Sicherheitshalber testen zwei Drittel Person jedoch Symptom Entscheidung ebenfalls 13 April geltend quarantäne söld kommend Tag fallen Freitag präsentieren Wissenschaftsminister Heinz_faßmann övp sowie Günther Ogris Christoph Hofinger sora-institut Ergebnis corona-prävalenz-studie demnach betragen Prävalenz 033 Prozent hochrechnen Bevölkerung sein 28500 Person infizieren Konfidenzintervall liegen allerdings 10200 67400 -- Spektrum real Zahl infiziert 95-prozentiger Wahrscheinlichkeit bewegen Studie bereits zuvor Kritik geben Gesundheitsminister_Rudolf_anschober_grün sagen Freitagmittag Österreich befinden sicher Seite spitalskapazitäen betreffen bleiben appellieren Mensch riskieren Wetter ostern traditionell verhalten verführ gehen 14000 positiv getesteten Person 17 April heißen gemeinsam Pressekonferenz anschober gesundheit-österreich-geschäftsführer Herwig Ostermann Verhandlung eu-finanzminister gemeinsam corona-hilfen finden donnerstagabend erfolgreich Ende 500 Milliarde schwer Rettungspaket sollen Italien Spanien profitieren Gelder sollen gesundheitssystem fließen bei nächster video-eu-sondergipfel 23 April sollen Finanzminister Paket voranbringen Nacht Freitag werden mehrere erwarten Verordnung kundgemachen enthalten Verlängerung Ausgangsbeschränkung Ende April Maskenpflicht Supermärkt öffentlich_Verkehrsmittel Regel Hochzeiten begräbnisse schrittweises hochfahren Handel Ausweitung Gesundheitskontrolle grenzübergängen nachbarländern Covid-19 erkranken britisch Premierminister Boris Johnson Freitag Gesundheitlich bergauf gehen Johnson Montag wegen Covid-19-erkrankung Intensivstation verlegen werden können mittlerweile verlassen Johnson Aufgabe übernehmen zwischenzeitlich Außenminister Dominic Raab wichtig_corona-regel lauten bleiben weit möglich Hause schränken sozialkontakt einkaufen Grundversorgung gewährleisten gestatten Aufenthalt öffentlich_Raum allein Person gemeinsam_Haushalt halten Abstandsregel mindestens_Meter weit_Information_ages_beantworten Frage rund Coronavirus_Nummer 0800_555 621_sollen_Symptom_aufweisen rufen_landesweit gültig_Gesundheitshotline_1450_wichtig Frage_Antwort Coronavirus_aktuell_zahlen Coronavirus aktuell_Covid-19-situation Österreich ages_bestätigen_Fall_Testunge Österreich_Gesundheitsministerium_Hinweis Situation_verhaltensregeln mehrere_Fremdsprache_Integrationsfond red 1042020 apaherbert-pfarrhoferfoto Epapatricia -- Melo Moreirafoto Reutersgoran Tomasevic Isabel infant Afpfoto Vanessa Carvalho via_wwwimago-imagesdefoto Sonia Moskowitz via_wwwimago-imagesdefoto imagesjohn Moorefoto Regine Hendrich Epabart Maatfoto ap John Minchillo Thomas imophototheknen via_wwwimago-imagesdefoto Reutersbrendan Mcdermid Epastephanie Lecocqfoto Epawill Oliver | Paznaun st Anton bleiben quarantäne fast fünfter freiwillig Test positiv
2000116819342,3,﻿20coronavirusiwf prognostizieren schlimmste Rezession seit 1930er- Jahr Coronavirus -iwf-prognostiziert-schlimmste-rezession-seit-1930er- Jahr Differenz offiziell Bilanz Todesfällen Österreich 332 384 tot scharf_Kritik kurz Aussage verfassungskonformität corona-gesetzen trump frieren Zahlung who wichtig_kürzen Dienstag erfolgen Öffnung klein Geschäft erster Schritt stufenweise hochfahren Wirtschaft Maskenpflicht gelten mehr bei einkaufen Supermarkt Geschäft öffnen öffentlich_Verkehrsmittel Taxis Pressekonferenz sagen Bundeskanzler_Sebastian kurz Kurs Sportveranstaltung aussehen Mittwoch Fahrplan Kulturveranstaltung Freitag bekanntgeben US-Präsident_Donald_trump frieren Zahlung Weltgesundheitsorganisation Gesundheitsministerium neu Dashboard ausrollen demnach Österreich 332 Person Covid-19 sterben informationsseite Ministerium seit Dienstagfrüh 384 verstorben angeben offenbar niedrig Zahl direkt Lungenerkrankung verstorben Person umfassen hoch Person inkludieren positiv Virus testen werden Todesursach sterben international Währungsfonds iwf senken Prognose nie dagewesen Ausmaß 2020 vermutlich schlimmste Rezession seit 1930er -jahren bringen Mittel Kurzarbeitsunterstützung weit mal aufstocken diesmal drei fünf Milliarde Euro mittlerweile Arbeitsplatz 608607 Mensch entsprechend Antrag stellen werden gut 200000 mehr Anfang vorig Woche Gesundheitsminister_Rudolf anschober kündigen zib2 Expertengruppe allfällig unschärfen Gesetz Verordnung erlässen bereinigen acht Salzburger Gemeinde fünf Gemeinde großarl- Gasteinertal sowie Flachau Saalbach Zell see werden Montag quarantäne aufheben Altenmarkt quarantäne vorerst Mittwoch verlängern geben Infektionsherd Altenwohnheim Mittwoch sollen neu testergebnisse vorliegen Tirol bleiben söld st Anton Arlberg Gemeinde Paznauntal 26 April quarantäne österreichisch Gewerkschaftsbund fordern Fall Staatshilfe aua Teilverstaatlichung Frankreich Maßnahme Coronavirus 11 Mai verlängern erst danach Schule Universität schrittweise öffnen mindestens Mitte Juli dürfen Veranstaltung stattfinden geben Präsident emmanuel Macron montagabend bekennen US-Präsident_Donald_trump holen täglich press-briefing Montag Rundumschlag Medium demokraen zeigen beispiellos Manier Video us-medien Propagandavideo bezeichnen werden USA mehr 22000 Mensch infolge Coronavirus sterben vereinigt Staat somit Italien Land meister Todesfällen überholen allein New York stehen Montag mehr 10000 Mensch wichtig_corona-regel lauten bleiben weit möglich Hause schränken sozialkontakt einkaufen Grundversorgung gewährleisten gestatten Aufenthalt öffentlich_Raum allein Person gemeinsam_Haushalt halten Abstandsregel mindestens_Meter weit_Information_ages_beantworten Frage rund Coronavirus_Nummer 0800_555 621_sollen_Symptom_aufweisen rufen_landesweit gültig_Gesundheitshotline_1450_wichtig Frage_Antwort Coronavirus_aktuell_zahlen Coronavirus aktuell_Covid-19-situation Österreich ages_bestätigen_Fall_Testunge Österreich_Gesundheitsministerium_Hinweis Situation_verhaltensregeln mehrere_Fremdsprache_Integrationsfond red 1442020 Imagesspencer Plafoto imageshan Lucas Braulio Jatar via_wwwimago-imagesdefoto apaexpa Johann Groder | iwf prognostizieren schlimmste Rezession seit 1930er-jahren
2000116740663,3,﻿20 mitreden corona -maßnahme Erfahrung Polizei mitreden-corona-massnahmen-ihre-erfahrungen-mit-der- Polizei werden jemand Umfeld Verstoß corona-maßnahmen strafen Abgemahnt letzter Zeit positiv Begegnung Polizei tauschen Forum erzählen Begegnung Polizei 2000 anzeigen 380 Organstrafmandat Bilanz osterwochenendes Österreich seit kurz gelten 25 Euro Verstoß Maskenpflicht öffis Nichteinhalt Ausgangsbeschränkung geben Strafe 50 Euro Regel Tag befolgen kommen unregelmäßig Abstände neu Herausforderung Mensch Land leben Exekutivbeamt -beamtinne derzeit erhöht Präsenz besonders stark frequentieren plätzen Einhaltung Regel sorgen müssen dabei kommen natürlich immer Nachvollziehbarem durchgreifen Polizei user berichten Wiener Polizeipräsident Gerhard pürsln Falter -interview stimmen Anfang perfekt laufen eineinhalb schön wochenenden lang kämpfen glauben schwierig vorgeben letzter 8000 Mitarbeiter bringen übereifrig wollen Empfehlung Experte Durchbruch verhelfen geben Verständnis oftmals streng durchgreifen Polizei positiv Erlebnis Polizei Social Media teilen Erfahrung letzter Woche Polizei machen werden Verstoß corona-maßnahmen bereits Abgemahnt gar strafen positiv auffallen negativ Verständnis streng Kontrolle Maßnahme erhöht Präsenz teilen Erfahrung Forum aan 1542020 Thema Verstoß Maskenpflicht kosten 25 Euro drohnen Checkpoints Italien jagen ausflüglern genau trotz Ausgangsbeschränkung erlauben -- 1051831326hundewiese heute ca 11 Uhr Altstadt 3 jung Polizist zerbrechlich alt aussehend Herr Frage Hilfe brauchen einkäufe Hause bringen spät paar Tag besuchen sicher gut gehen Mdash Sorin Balasko Balasko Sorin April 11 2020 neu_html Tag neu Tweet Apahelmut_Fohringerfoto apaherberen_p oczeret1052763451verständnis1052764210gart | corona-maßnahmen Erfahrung Polizei
2000120115898,3,﻿20tagesüberblick coronavirus813 neuinfektion Österreichweit fallzahlen Wien knapp höchstwerttagesueberblick-coronavirus-813-neuinfektionen-oesterreichweit-fallzahlen-in-wien-knapp-an hoechstweren verschärfen corona-maßnahmen per Verordnung offiziell gelten ab Montag wichtig corona-news Tag Überblick_wichtig kürzen Österreich geben vergangen 24_Stunde 813 neuinfektion Coronavirus insgesamt steigen Zahl positiv testergebnisse somit 37474 meister neuinfektion geben 432 Wien liegen knapp bisherig tageshöchstweren 444 neu fällen Gesundheitsminister_Rudolf anschober orten wegen lang wartezeiten corona-tests versäumnisse Bundesland haben vieler Behörde Personal aufstocken Wien müssen dafür massiv Geld Hand nehmen Zahl Intensivpatient monatsend Dreistellig Bereich ab Montag null Uhr Coronamaßnahmen verschärfen privat Veranstaltung Innenraum beschränken Maskenpflicht ausweiten seit Freitagabend Detail neu Verordnung bekennen Wiener Bürgermeister_Michael_Ludwig Freitagabend weit coronavirus-teststraße bei ernst-happel-stadion ankündigen Person gering Symptom kommen außerdem sollen mobil Team gurgeltests Schule durchführen Wiener Ballsaison aufgrund corona-pandemie platzen Komitee Wiener nobel- traditionsbälle sondertreffen Freitag entscheiden Veranstaltung gegeben Umstand durchführen betreffen ärzteball Juristenball Ball Offizier Concordiaball sowie Ball Pharmacie Jägerball werden bereits absagen unklar Wiener Opernball stattfinden Oper kommentieren Arbeitsministerin Christine aschbach März 2021 neu Regelung Homeoffice präsentieren sagen Freitag treffen Vertreter Sozialpartner einheitlich Regel Homeoffice beraten werden aschbach kündigen eigen arbeitskreise sozialpartnern einberufen neu Lösung finden Aparoland_schlagerfoto Standardelmar Gubisch apaherberen pfarrhoferfoto Aparoland_schlagerfoto Apahelmut_Fohringerfoto_Reutersleonhard_Foeger apabarbara_Gindlfoto apadpasven_Hoppe Dapd Sebastian Widmann Hans_Punz_| 813 neuinfektion Österreichweit fallzahlen Wien knapp höchstweren
2000120124979,3,﻿20coronavirus68 corona-patienten Österreich intensivstationen Reproduktionsfaktor 129coronavirus-68-corona-patienten-in-oesterreich-auf-intensivstationen-reproduktionsfaktor-bei-129kanzler kurz corona-maßnahmen eigen Angabe früh verschärfen morgen treten Kraft corona-news_Überblick_wichtig_kürzen Zahl aktiv sars-cov-2-infizierten Österreich Sonntag 8000er-marke überschreiten Reproduktionsfaktor liegen aktuell 129 laut Angabe innen Gesundheitsministerium stehen 930 Uhr 8100 Mensch aktiv infizieren binnen_24_Stunde kommen 621 neuinfektion hinzu zahlen finden groß Überblick 68 corona-patienten Österreich liegen derzeit intensivstationen davon 38 Wien coronavirus-erkrankte Spital behandeln müssen stehen 400 Normalbett 150 intensivstationen Verfügung anschober verkünden Woche mehr 100000 Testunge Rekordzahl erreichen werden Bundeskanzler_Sebastian_kurz_övp laut eigen Aussage schon früh neuerlich ansteigen Infektion reagieren sein alleinig Entscheidung sagen Österreich Stadt Wien gemeinsam Polizei Covid-19-kontrollen 26 betreiben Wiener Clubszene durchführen Dutzend verstößen werden registrieren ab Montag null Uhr corona-maßnahmen verschärfen privat Veranstaltung Innenraum beschränken Maskenpflicht ausweiten seit Freitagabend Detail neu Verordnung bekennen weltweit inzwischen mehr 3055 Million Mensch Coronavirus infizieren fast Million sterben USA bleiben rund 67 Million bestätigen fällen fast 200000 tot stark betroffen Land folgen Indien Brasilien red 2092020 Imageshollandse hoogen Alessandro Della vallefoto Afpjack Guezfoto Aparoland_schlagerfoto Aparoland_schlagerfoto Standardelmar Gubisch apaherberen pfarrhoferfoto Aparoland_schlagerfoto Apahelmut_Fohringerfoto_Reutersleonhard_Foeger apabarbara_Gindlfoto apadpasven_Hoppe Dapd Sebastian Widmann Hans_Punz_| 68 corona-patienten Österreich intensivstationen Reproduktionsfaktor 129
2000120510206,3,﻿20tagesüberblickberlin führen wegen steigend_Infektionszahl sperrstunde 23 Uhr eintagesueberblick-berlin-fuehrt-wegen-steigender-infektionszahlen-sperrstunde-um-23-uhr-ein923 neuinfektion letzter 24_Stunde Rekord bestätigen aktiv fällen Österreich Klimaschutzministerin Leonore Gewessler werden negativ testen wichtig corona-news_Überblick_wichtig_kürzen stehen Dienstag 930 Uhr geben Österreich 923 neuinfektion 9207 bestätigen infiziert werden neu rekordweren aktiv erkranken erreichen Berlin führen allgemein sperrstunde gastronomiebetriebe Geschäft 23 Uhr corona-tests Klimaschutzministerin Leonore Gewessler grün steirisch Landeshauptmann Herrmann Schützenhöfer övp negativ Rumänien verschärfen Einreisebestimmung Österreich einreisend Österreich müssen ab Mittwoch 14 Tag quarantäne ab achten Tag pcr-test durchführen lassen -- fallen negativ quarantäne zehnter Tag aufheben Ausnahme geben Kurzurlauber Umweltministerin Leonore Gewessler grün Isolation steirisch Landeshauptmann Hermann Schützenhöfer övp befinden quarantäne infiziert Person Kontakt Schützenhöfer Symptom Stadt Wien Wiener Wirtschaftskammer digital gästeregistrierungssyst Gastronomie ausarbeiten 845 Prozent Gastrogutscheine werden eingelösen Montagnachmittag werden bekennen eng Mitarbeiter Bundeskanzler_Sebastian_kurz_övp Coronavirus anstecken innerhalb Bundesregierung fallen daraufhin Test negativ wohl positiv Virus testen werden bekanntlich US-Präsident_Donald_trump lassen Wochenende Spital behandeln bereits verlassen Paris direkt Umgebung werden Montag hoch alarmstuf ausrufen Bar bleiben ab Dienstag mindestens zwei Woche schließen Italien Regierung planen Einführung landesweit Maskenpflicht frei Kontakt positiv getesteten Person eu Kommissionspräsidentin Ursula Leyen vorsorglich quarantäne begeben heutig dienstagabend verlassen red 6102020 Stefan Zeitz via_wwwimago-imagesdefoto Reutersleonhard_Foeger Apahelmut_Fohringerfoto alex Halada picturedeskcomfoto Epabogdan Cristelfoto Aparoland Schlager | Berlin führen wegen steigend_Infektionszahl sperrstunde 23 Uhr
2000120833582,3,﻿20_Coronavirus scharf_Kritik Expertenkommission Ischgl Tschechien schließen Bar Coronavirus -scharfe-kritik-von-expertenkommission-zu-ischgl-tschechien-schliesst- Bar Expertenkommission kritisieren Bericht Gesundheitsministerium Bundeskanzler kurz wichtig_kürzen sechsköpfig Expertenkommission Untersuchung corona-krisenmanagements Ischgl Montag Bericht präsentieren Kommissionsvorsitzende Ronald Rohrer zufolge werden corona-management Land Tirol bestimmen richtig machen zeigen Reihe verfehlungen etwa lokal Behörde schlecht vorbereiten haben Gesundheitsministerium früh reagieren müssen evakuierungspläne Pandemiefrag Fehleinschätzung spät handeln Rolle Ischgler Bürgermeister zwei Tag warten lifte schließen unverzüglich haben tun sollen werden scharf kritisieren neben scharf_Kritik Öffentlichkeitsarbeit Land bleiben Kritik Bundeskanzler_Sebastian_kurz_övp hängen voreilig Kommunikation quarantäne Chaos sorgen angesichts steigend fallzahlen müssen Bar Restaurant Clubs Tschechien ab Mittwoch zusperren Großteil Schule stellen Heimunterricht Sonntag Montag werden 979 neuinfektion Österreich registrieren meister neu Fall geben Wien 327 dahinter folgen Niederösterreich 170 oberösterreich 130 Tirol 124 Land Salzburg sonntagabend Veranstaltungsverbot gesamt tennengau beschließen Gemeinde Kuchl darüber_hinaus sperrstunde 17 Uhr vorverlegen Maßnahme gelten ab Dienstag vorerst Montag 26 Oktober 24 Uhr us-seuchenexperte Anthony Fauci sehen Wahlwerbung us-präsidenten Donald_trump falsch zitieren Gesundheitsministerium heißen Reaktion Zib -bericht samstagabend neuerlich Lockdown planen sein sein möglich kommend Tag Verschärfung bundesweit Maßnahme bezüglich Maskenpflicht Veranstaltung kommen Verlängerung 24 Oktober beginnend einwöchig Herbstferien Bildungsministerium Thema Slowenien nehmen Tirol Vorarlberg rot Liste einreisebeschränkungen Slowenien gelten weiterhin Wien red 12102020 mehr_Thema_Symptom Covid-19_Grippe grippal_Infekt unterscheiden_standard-community erzählen_corona-krankheitserfahrungen_betroffen_erzählen Covid-19_überstehen Reuter lisi Niesnerfoto Apadpauli Deck | scharf_Kritik Expertenkommission Ischgl Tschechien schließen Bar
2000121201027,3,﻿20_Coronavirus rund 1500 corona-verharmloser demonstrieren Wien Abstand Maske Coronavirus -rund-1500-corona-verharmloser-demonstrierten-in-wien-ohne-abstand-und-ohne- Maske zahlreich verstößen covid-19-gesetz Ahndet Behörde Polizei sehen Gesundheitsbehörde Pflicht widersprechen sicher Demonstration corona-maßnahmen Regierung Montagnachmittag Potential superspreader-event dichtgedrängen Großteils Maske protestieren 1500 Person Wiener Oper zahlreich teilnehmend finden corona-leugner Maskenverweigerer impfgegn Verschwörungstheoretiker organisieren Rechtsextrem angesichts zahlreich verstößen Covid-19-maßnahmengesetz mussen veranstaltungsorganisatoren Teilnehmer via Mikrofon auffordern Abständ einhalten erklären Polizei standard-anfrage allerdings sein teilnehmend Reaktion kommen Polizei anschließend zuständig sindheitsbehörden rücksprach halten weit Maßnahme Durchsetzung Gesetz verzichten haben kompetenz-hickhack Polizei Wiener Magistrat Darstellung widersprechen Stadt Wien zuständig Gesundheitsbehörde Twitter Gesundheitsbehörde können Expertise beisteuern tatsächlich Entscheidung verstößen ahnden liegen Polizei versammlungsbehörde Stadt Wien Hitlergruß kz-vergleiche frei Journalist Michael Bonvalot Trubel vorfall Rechtsextremismus dokumentieren Teilnehmer vergleichen impfen Massenmord nationalsozialisen Karton Zeichnung sehen offensichtlich Konzentrationslager darstellen sollen torbogen Satz impfen machen frei lesen Teilnehmer zudem Hitlergruß zeigen Journalist Kundgebung sagen Sprecherin Mikrofon Maske mehr schaden helfen werden Demonstration lokal Stimmung machen Maskenpflicht durchsetzen bereits zuvor skandieren Mensch Ort lügenpresse Augenzeugin Standard Rand Demonstration bilden klein antifaschistisch Gegendemonstration Lalo 26102020 Update 2008 Uhr Stellungnahme Stadt Wien vergleichend Tweet werden hinzugefügt weiterlesen virale querfront Qanon Neonazi wegbegleitern schwarze Witwe corona-leugner Handymaste zerstören Kommentar Fabian Schmid impfgegn Neonazismus -- brauen zusammen Demonstration Wien werden zahlreich verstößen Covid-19-maßnahmengesetz feststellen ahnden corona-leugner tun Österreich rechtsradikale Fan irren qanon-verschwörungstheorie zusammen neu Tweet Standard privat Standard privat Standard privat neu Tweet | rund 1500 corona-verharmloser demonstrieren Wien Abstand Maske
2000121671795,3,﻿20_Coronavirus corona -ampel Österreich bleiben Rotcoronavirus-corona-ampel-oesterreich-bleibt-rotdie corona-ampelkommission donnerstagabend offenhalten Schule 14-jährig aussprechen Wien -- corona-kommission Gesundheitsministeriums Sitzung Donnerstagnachmittag gleich Einschätzung vorwoch kommen Infektionsrisiko gesamt Land hoch bleiben werden Ampel vorwoch bezirke Bundesländ gesamt Land rot stellen oberösterreichisch Nachricht berichten werden weit Maßnahme eingemahnen Zusammenbruch Gesundheitssystems verhindern laut oön Kommission angesichts dramatisch corona-lage Österreich Politik geraten möglichst zeitnah zusätzlich Maßnahme ergreifen Zusammenbruch Gesundheitssystems verhindern konkret werden Empfehlung verweisen werden ausgangsregeln Betretungsverbote covid-maßnahmengesetz dürfen wohl bedeuten Sicht Experte Ausgangsbeschränkung Handel Dienstleistung öffentlich Ort öffentlich Verkehr nachgeschärfen bereits gesetzt Gelindere Maßnahme_Eindämmung infektionsgeschehens ausreichend Wirkung entfalten zitieren Zeitung Beschluss 17 19 kommissionsmitgliedern haben zustimmen Vertreter Kärnten Fachexpertin enthalten heißen Kommission offen Schule zudem Ampelkommission donnerstagabend offenhalten Schule 14-jährig aussprechen Teilnehmerkreise erfahren Beschluss fallen demnach einstimmig lediglich Bundeskanzleramt enthalten Empfehlung kindergärten volksschulen sowie sekundarstufe 1 1014-jähriger möglichst lang offenhalten bleiben aufrecht heißen Beschluss Betreuungseinrichtung handeln aktuell_zahlen Agentur Gesundheit Ernährungssicherheit ages Treiber infektionsgeschehens Bildungsministerium weit Präventionsmaßnahm empfehlen Schulbetrieb 10 14-jährig Gruppe höherem Infektionsgeschehen 10-jährigen weiterhin ermöglichen sollen Antigen-schnelltest Einsatz kommen Maskenpflicht Schüler Lehrer Unterricht Staffelung schul-öffnungszeiten Nutzung groß räume Sport frei red 12112020 neu Tweet Apahelmut Fohringer if Aparesc Var Aparescfunction a Var ewindowadd Event_listen add Event_listen Attachevent t_n 0 Window e Attachevent e Onmessage Message function e if Edata a for Var Tdocumentget Elements by Class Name a N0 n Tlength n t_n styleheightedata a px 1 Aparesc apa-132820 neu_html Tag | corona-ampel Österreich bleiben rot
