ID_GodotObject,cluster_value,merged_text
2000120135831,5,﻿20 Wien Klinik favoriten nehmen corona-patienten mehr aufwien-klinik-favoriten-nimmt-keine-corona-patienten-mehr-aufkapazität erster Spital erschöpfen vieler Plätz Haus frei -- Österreichweit 68 Intensivpatient 38 Wien -- neu Regel Freizeitaktivität Wien -- Zahl aktiv sars-cov-2-infizierten Österreich Sonntag 8000er-marke überschreiten stehen 930 Uhr Sonntag 8100 Mensch aktiv infizieren liegen rund 1000 Person bisherig Höchstmarke Österreich Lockdowns binnen_24_Stunde kommen Sonntag 621 neuinfektion hinzu -- Samstag 813 rückläufig zahlen Spital Intensivstation liegend Patient Reproduktionsfaktor liegen Sonntag 129 Samstag mehr 18000 Test epidemiologisch Melderegister ems eintragen werden kommen Sonntag 12584 hinzu somit deutlich weniger vergangen Tag mehr zeigen Sonntag Wochenende Österreich weniger testen bzw auswerten besonders gering zahlen melden Burgenland 137 binnen_24_Stunde Kärnt 162 Wien kratzen 5000er-marke -- 4943 pcr-untersuchungen kommen Samstag Sonntag hinzu mehr 100000 Testunge vergangen Woche Gesundheitsminister_Rudolf_anschober_grün betonen vergangen Woche mehr 100000 Testunge Rekordzahl erreichen werden Schnitt geben September bisher durchschnittlich 13200 Test Hauptursache Infektion gelten reiserückkehr 1100 Kroatien rund 600 Türkei regional Clusterbildung privat fest barbesuchen erster Wiener Spital Kapazitätsgrenze covid-19-patienten erreichen Klinik favoriten ehemals kaiser-franz-josef-spital nehmen intensiv- normalpatienn mehr spitälern sein genug Bett frei heißen bei Gesundheitsverbund 68 corona-patienten intensivstationen davon 38 Wien derzeit befinden Wien 173 covid-19-patienten Krankenhaus 38 davon intensivmedizinisch betreuen coronavirus-erkrankte Spital behandeln müssen stehen derzeit laut Wiener Gesundheitsverbund 400 Normalbett 150 intensivstationen Verfügung zusätzlich bettenkapazitäen Bedarfsfall sofort covid-erkrankte freimachen sagen Sprecher Gesundheitsverbunds vormals Kav aktuell etwa Klinik Hietzing covid-station vorbereiten bemerkenswert Österreichweit 68 Patient intensivstationen 38 Wien Montag treten Österreich verschärfen Maßnahme Veranstaltung Kraft gehören · zehn Person Limit gelten sozial Aktivität Gruppe Geschlossen_räumen Yogakurse Spieleabend Hochzeiten Filmvorführung Ausstellung vernissagen kongresse ausnehmen begräbnisse · 100 Person Teilnehmerzahl dürfen gruppenaktivität frei überschreiten professionell Veranstaltung Sicherheitskonzept fix sitzplätzen erhöhen Limit 3000 Person Innenräume maximal 1500 babyelefant Platz herrschen Maskenpflicht · Sport fitnessstudios gelten Gerät Maskenpflicht mannschaftssportarten Hobbybereich zehn-personen-regel ausnehmen Simo 2092020 Österreichweit 68 corona-patienten intensivstationen 38 Wien unterbringen erster Wiener Spital Klinik favoriten Kapazitätsgrenze covid-19-patienten erreichen werden neu Tweet Reuter lisi niesner | Klinik favoriten nehmen corona-patienten mehr
2000120137622,5,﻿20_Coronavirus Test arztpraxen gesetzlich verankern 563 corona- neuinfektion Coronavirus -tests-in-arztpraxen-werden-gesetzlich-verankert-563-corona- neuinfektion Niederösterreich werden mehr neuinfektion Wien melden Tschechien Gesundheitsminister Vojtěch zurücktreten wichtig_kürzen türkis-grüne Koalition planen weit Gesetzesänderung Nationalrat etwa covid-19-tests arztpraxen beschließen Kasse kosten Bund bezahlen entsprechend Antrag Montag Gesundheitsausschuss Richtung Plenum schicken Nationalrat finden Expertenhearing statt innerhalb 24_Stunde Zahl corona-infektionen Österreich zuletzt 563 steigen bisher geben Österreich 38658 positiv testergebnisse Niederösterreich liegen diesmal neuinfektion Wien verzeichnen 181 neuinfektion 1552 eingemeldeten Test bedeuten rund 117 Prozent gemeldeen Test positiv allerdings Nachmeldung liegen Freitag geben Einmeldung Test 891 stark Ausreißer unten Wien geben 172 neuinfektion 4369 eingemeldeten Test trefferquot knapp vier Prozent entsprechen corona-krise Österreich signifikanen Anstieg häuslich Gewalt führen geben Innenminister Karl Nehammer Frauenministerin Susanne Raab beide övp Montag bekennen verhängt annäherungs- Betretungsverbote demnach 886 Februar 1081 April erhöhen Juli 1085 August 1055 September bisher 507 meister coronavirus-genesenen alt 15 40 Jahr weisen Krankheit Antikörper gehen Reichenau rax durchgeführen Erhebung hervor überraschend decken mild Verlauf weniger Antikörper bilden erklären niederösterreichisch Landessanitätsdirektorin Irmgard Lechner Regierungsberater Epidemiologe Roman Prymula neu Gesundheitsminister Tschechien Präsident Miloš Zeman Prymula Montagnachmittag ernennen Dienstag parteilos 56-jährig Nachfolger zurückgetretenen Adam Vojtěch anloben sagen Ministerpräsident Andrej Babiš Montag Nachrichtenagentur ctk München verschärfen corona-maßnahmen ab Donnerstag dürfen öffentlich_Raum fünf Mensch treffen privat feiern Geburtstage Hochzeiten Beerdigungen gelten künftig Höchstgrenze 25 Mensch Geschlossen_räumen 50 Mensch treffen draußen außerdem ordnen Stadt Maskenpflicht einzeln stark besuchen Ort Marienplatz viktualienmarken Gesundheitsminister_Rudolf_anschober_grün zeigen sonntagabend orf-sendung Zentrum zuversichtlich zweiter corona-welle verhindern Regierung sein professionell schwierig Situation Herbst vorbereiten 11 Oktober finden Wien gemeinderats- Bezirksvertretungswahl statt Tag 1494 Wahllokal 7 17 Uhr öffnen dabei gelten etwa Maskenpflicht ein-meter-abstand Wähler wählerinnen bitten eigen Kugelschreiber ankreuzen mitnehmen heute Österreich weit Einschränkung Kraft_treten zehn-personen-limit gelten grundsätzlich sozial Aktivität Gruppe Geschlossen_räumen stattfinden sperrstunde generell 1 Uhr festlegen -- Gastronomie sowie Geschlossen Veranstaltung Hochzeiten Festivität ebenso maximal zehn Person privat angemieteten Clubs Lokalitäten red 2192020 Apadpamaurizio Gambarini Reutersleonhard_Foeger Apapidmarkus Wachefoto Imageshollandse hoogen Alessandro Della vallefoto Afpjack Guezfoto Aparoland_schlagerfoto Aparoland_schlagerfoto Standardelmar Gubisch apaherberen pfarrhoferfoto Aparoland_schlagerfoto Apahelmut_Fohringerfoto_Reutersleonhard_Foeger apabarbara_Gindlfoto apadpasven_Hoppe Dapd Sebastian Widmann Hans_Punz_| Test arztpraxen gesetzlich verankern 563 corona-neuinfektionen
2000122402488,5,﻿20tagesüberblick_Coronavirus Maskenpflicht frei Arbeitsplatz silvesterfeiern maximal zwei haushalen Tagesueberblick -coronavirus-maskenpflicht-im-freien-und-am-arbeitsplatz-silvesterfeiern-mit-maximal-zwei- haushalen zehn Person heilige Abend christtag nächtlich Ausgangsbeschränkung Silvester wichtig corona-news Tag wichtig_kürzen Regierung Bundesland neu Regel Weihnachtsfeiertage Silvester verständigen zudem kommen Maskenpflicht stark frequentieren Ort frei Arbeitsplatz abstandsregeln einhalten 8 10 Jänner zweiter rund Massentest vorsehen Wien 8 17 Jänner Berufsgruppe etwa Lehrer körpernah_Dienstleister verpflichtenden Test geben Reproduktionszahl Österreich stehen Freitag leicht 079 sinken vergangen Woche 082 liegen Freitag werden 126 weit Todesfäll melden 2893 neuinfektion Salzburg oberösterreich Kärnt Freitag corona-massentests beginnen red 11122020 mehr_Thema_Symptom Covid-19_Grippe grippal_Infekt unterscheiden_standard-community erzählen_corona-krankheitserfahrungen_betroffen_erzählen Covid-19_überstehen Hochmuth apaherberen Oczeret Hanz Punkz aparobert Jaegerfoto apaherberen_p Oczeretfoto Thomas Samsonfoto go Nakamura Reutersradovan Stoklasafil photo Apaerwin Scheriaufoto Tobias schwarz Afpandy Stenningfoto Apahelmut_Fohringerfoto Afpowe Humphreys Epadominic Lipinski Barbara_Gindlfoto Herbert_Neubauerfoto apaherberen_Neubauerfoto apabarbara Gindl | Maskenpflicht frei Arbeitsplatz silvesterfeiern maximal zwei haushalen
2000122442386,5,﻿20fragen Antwort vieler Mensch Weihnachten Silvester werktagen treffen fragen-und-antworten-wie-viele-menschen-kann-man-nun-zu-weihnachten-zu-silvester-oder-an-werktagen-treffendie wichtig Frage_Antwort corona-maßnahmen Feiertage Freitagnacht verkünden Bundeskanzler_Sebastian_kurz_övp vizekanzler_Werner_Kogler grün corona-maßnahmen Feiertage präsentieren Plan Massentest Anfang kommend Jahr gerade privat Bereich Ansteckung hoch betonen kurz treffen landeshauptleuten Virus machen Feiertag halten Ansteckungsniveau sein hoch Jänner Februar März hart Zeit Österreicher zukommen Frage Regelung gelten aktuell wen dürfen derzeit treffen Antwort derzeit gelten schon hart Lockdown 6 Dezember auslaufen Kontaktbeschränkung ausgangssperren Nacht 20 Uhr abends 6 Uhr früh dürfen eigen vier wände gründen verlassen Arbeit bedürfnisse täglich Leben Hilfe Mensch Bewegung frisch Luft tagsüber dürfen hingegen maximal sechs Erwachsene plus sechs Kind zwei unterschiedlich haushalen treffen Frage Regelung gelten Weihnachten Antwort Weihnachtsfeiertag sollen kontakt- Ausgangsbeschränkung lockern Familie Tag gemeinsam verbringen 24 25 Dezember dürfen daher zehn Person beliebig vieler haushalen treffen gemeinsam Geschenke auspacken -- 20 Uhr Frage gelten Lockerunge ganz Weihnachtsfeiertage Antwort ursprünglich andachen wegen weiterhin hoch infektionsgeschehens entscheiden Bundesregierung jedoch Ausnahme 24 25 Dezember beschränken Stefanitag 26 Dezember gelten gewohnt Beschränkung zwei haushalen dürfen maximal sechs Erwachsene plus sechs Kind 20 Uhr treffen Frage Silvester feiern Antwort Jahreswechsel klein Kreis feiern bisher denken Nacht 31 Dezember 1 Jänner gelten entfallen nächtlich Ausgangsbeschränkung heißen wann Nacht Einladung Hause fahren egal jedoch bleiben Kontaktbeschränkung aufrecht bedeuten -- Tag -- maximal zwei Haushalt Größe insgesamt sechs erwachsen plus sechs Kind anstoßen neu Jahr treffen Frage wann Weihnachten -- Zug Massentest -- testen lassen Antwort Tirol Vorarlberg Massentestung bereits abschließen Bundesland Coronavirus testen lassen Wien Kärnt Salzburg Niederösterreich Steiermark Sonntag 13 Dezember möglich oberösterreich Montag 14 Dezember Zeit Burgenland Test Dienstag 15 Dezember möglich Frage geben zweiter massentest-termin Antwort ja planen zweiter Durchlauf Anfang Jänner meister Bundesland Testung 8 10 Jänner Bühne gehen Wien wegen hoch Bevölkerungszahl lang brauchen test-dauer darum 17 Jänner ausdehnen Frage geben Möglichkeit Test fest Antwort ja Symptom Bundesland weiterhin 1450 anrufen corona-virus testen Symptom geben mittlerweile diverser Möglichkeit Schnelltest beispielsweise Apotheke kosten rund 30 Euro dauern halb Stunde Ergebnis vorliegen geben groß Bandbreite Schnelltest Standard davon testen Wien geben zudem drei gratis teststraßen Stadt Teststraße bei ernst-happel-stadion Donauinsel seit neu Teststraße Austria Center vienna Letzterer kommen Antigen-schnelltest Einsatz beide gurgeln Frage geben Testunge bestimmen Berufsgruppe Antwort ja ausweiten sollen regelmäßig zielgruppen-testungen künftig medizinisch_Personal Mensch körpernah Dienstleistung Berufsgruppe kundenkontakt sowie Pädagoginn Pädagog regelmäßig testen verpflichtend ab 8 Jänner sollen zwei Woche Covid-19 testen lassen müssen geben vieler Mensch schon Woche testen erklären Kanzler kurz Freitagnacht weit Gruppe ausweiten -- definieren sollen Lehrerinne Lehrer Körpernah tätig Frage besonders stark betroffener Region Antwort besonders betroffener Region inzidenzweren definieren Massentestung vornehmen quarantäne ersetzen Frage Maskenpflicht ausweiten Antwort Bundesländ erhalten künftig Möglichkeit Maskenpflicht stark frequentieren Zon frei einführen Plätz sollen Land bestimmen etwa gutbesuchen einkaufsstraßen etwa märkten erholungsgebieten städten Regierung Maskenpflicht vorstellen Frage sehen mund-nasen-schutz Arbeitsplatz Antwort derjenige Möglichkeit sollen weiterhin home Office arbeiten Arbeitsplatz müssen künftig Maskenpflicht einführen jedoch Mindestabstand einhalten ook 12122020 egal silvester-fan heurige Jahreswechsel speziell apaherberen_p Oczeret | vieler Mensch Weihnachten Silvester werktagen treffen
2000122440975,5,﻿20tagesüberblick_Coronavirus gering Testbeteiligung Wien zeichnen ab USA starten ab Montag Impfung Tagesueberblick -coronavirus-geringe-testbeteiligung-in-wien-zeichnet-sich-ab-usa-starten-ab-montag-mit- Impfung österreichisch Regierung denken offenbar anreizsystem Mensch teilnahmen Massentest bewegen wichtig corona-news Tag wichtig_kürzen Österreich vergangen 24_Stunde 3241 neuinfektion Virus registrieren werden Zahl Todesfäll steigen 126 übermittlung massentest-ergebnisse kommen Samstag Verzögerung System laut Meldung wegen teil-überlastung vorerst heruntergefahren Deutschland zeichnen vorgesprächen Bund Land offenbar hart Lockdown ab Mittwoch ab Wien gehen Sonntag letzter Tag Massentest bisher dürfen Beteiligung zehn Prozent liegen laut medienberichen überlegen Regierung anreizsystem Massentest schaffen Jänner Teilnehmerzahl steigern Regierung Bundesland neu Regel Weihnachtsfeiertage Silvester verständigen zudem kommen Maskenpflicht stark frequentieren Ort frei Arbeitsplatz abstandsregeln einhalten 8 10 Jänner zweiter rund Massentest vorsehen Wien 8 17 Jänner Berufsgruppe Lehrer körpernah_Dienstleister verpflichtenden Test geben Reproduktionszahl Österreich stehen Freitag leicht 079 sinken vergangen Woche 082 liegen USA ab Montag corona- Impfung beginnen us-arzneimittelbehörde fda impfstoff Biontech Notfallzulassung erteilen Deutschland melden mehr 28000 neuinfektion red 12122020 mehr_Thema_Symptom Covid-19_Grippe grippal_Infekt unterscheiden_standard-community erzählen_corona-krankheitserfahrungen_betroffen_erzählen Covid-19_überstehen Apaerwin Scheriau apaherberen Oczeret Hanz Punkz aparobert Jaegerfoto apaherberen_p Oczeretfoto Thomas Samsonfoto go Nakamura Reutersradovan Stoklasafil photo Apaerwin Scheriaufoto Tobias schwarz Afpandy Stenningfoto Apahelmut_Fohringerfoto Afpowe Humphreys Epadominic Lipinski Barbara_Gindlfoto Herbert_Neubauerfoto apaherberen_Neubauerfoto apabarbara Gindl | gering Testbeteiligung Wien zeichnen ab USA starten ab Montag Impfung
2000123339962,5,﻿20tagesüberblick_Coronavirus laut Verhandlerkreise Lockdown 7 Februar verlängerttagesueberblick-coronavirus-laut-verhandlerkreisen-wird-der-lockdown-bis-7-februar-verlaengertab 8 Februar ffp2-maskenpflicht vieler Bereichen gelten Mindestabstand zwei Meter erhöhen Schule bleiben lockdownende Distanzunterricht Detail regierungs-pk Sonntag 11 Uhr wichtig_kürzen 24 Jänner geltend Lockdown 7 Februar verlängern Ergebnis Verhandlung landeshauptleuten Bundesregierung samstagabend Verhandlerkreise erfahren danach schrittweise öffnen Gastronomie Hotellerie Veranstalter müssen allerdings Ende Februar dulden ab Montag 8 Februar sollen Handel körpernah Dienstleistung Museum öffnen dürfen allerdings verschärfen Bedingung sollen Ffp2-mask verpflichtend vorschreiben berühmt babyelefant wachsen zwei Meter Mindestabstand Beratung Regierung treten bereits m Samstagvormittag Gesundheitsexpert Presse Oswald Wagner medizinisch_Universität Wien sprechen Ende Lockdowns dafür sein sieben-tages-inzidenzen hoch liegen derzeit 130 150 Ziel weniger 50 senken dafür brauchen ffp2-maskenpflicht Abstand zwei Meter regelmäßig Testunge sagen Wagner sieben-tage-inzidenz 50 zwei drei Woche Lockdownverlängerung erreichen Mediziner Wagner halten verpflichtendes Homeoffice sinnvoll Ausbreitung Virus einzubremsen immer möglich Hause arbeiten Kind sollen Hause betreuen Virologe Andreas Bergthaler gehen davon britisch Variante Virus schon hoch Wahrscheinlichkeit großflächig Österreich ankommen Stichprobe 83 positiv pcr-tests 17 Prozent neu Virusmutation betreffen zeigen Analyse medizinisch_Universität Wien Fall verdachtsfälle Österreich werden Samstag 1723 neuinfektion Coronavirus registrieren 66 Todesfäll werden Verbindung Virus melden us-pharmakonzern Pfizer Produktionsanlag ausbauen mehr impfdosen herstellen vorübergehend liefermenge Biontech entwickeln Impfstoffs senken Österreich werden Freitagabend 68000 Impfung durchführen Sonntag Marke 100000 geimpften überschreiten red 1612021 mehr Thema corona-impfungen weitergehen Symptom_Covid-19 Grippe_grippal Infekt_unterscheiden standard-community_erzählen corona-krankheitserfahrungen_betroffen erzählen_Covid-19 überstehen warum Krisenstab ages unterschiedlich corona-zahlen berechnen Georg Hochmuth Standardmatthia Cremer Imagesphotothekfoto Apahan_Punzfoto Gerd eggenberg Roland schlagerfoto Barbara_Gindlfoto Apahan_Punzfoto Imagesgeorg Ulrich dostma Reuter Wolfgang rattayfoto Harald shcneider Harald shcneider Standardmatthia Cremer Reutersbenoit Tessierfoto apabarbara_Gindlfoto Miriam Alsterfoto Reuterssergio Perezfoto apadpatobiasn c Köhlerfoto images wolterfotofoto apaherberen_Neubauerfoto Imagesphotothekfoto Apahelmut_Fohringerfoto Apahelmut_Fohringerfoto Apadpasebastian Gollnow apaherberen_Neubauerfoto Bundeskanzleramtregina Aignerfoto Apagerd Eggenbergerfoto Apaangelika grabher-hollensteinfoto Walter Fritz Standardreiner Riedler Afplucas Bariouletfoto Apchristophe Archambault imageshan Lucas Afpjung yeon-jefoto Afpfoto Apaerwin Scheriau Standardrainer Riedler Apageorg Hochmuth | laut Verhandlerkreise Lockdown 7 Februar verlängern
2000125301517,5,﻿20tagesüberblick_Coronavirus Handel schließen ostern danach zugangstests -- Schule Fernunterricht Ferien Tagesueberblick -coronavirus-handel-schliesst-um-ostern-danach-zugangstests Schule-in-fernunterricht-nach- Ferien Gründonnerstag Osterdienstag Handel schließen Zeit gelten Ausgangsbeschränkung 0 24 Uhr wichtig_kürzen Mittwoch gehen Verhandlung Ostregion streng corona-maßnahmen Ende folgend Maßnahme werden Wien Niederösterreich Burgenland vereinbaren Handel Ausnahme gütern täglich Bedarf körpernah_Dienstleister 14 64 schließen ab 74 Handel zugangstests notwendig Innenräume gelten ffp2-maskenpflicht mehr Person anwesend gelten Menschenansammlung frei Schule gelten distance-learning Woche ostern danach Schrittweise pcr-tests Schule kommen Ausgangsbeschränkung rund Weihnachten ausgangssperre 024 Uhr üblich Ausnahme mehr kontrollen pendlern Risikogebiet -- zwei Test pro Woche stark kontrollen Grenze anschober Ostösterreich Pilotregion leicht Bundesland kommen Mittwoch werden 3289 corona- neuinfektion Österreich registrieren Deutschland nehmen Vorhaben zurück Land ostern Ruhetage Gründonnerstag Samstag Lockdown schicken kündigen Angela Merkel Mittwoch Test Ausreise Schwaz Tirol Verbreitung virusvariant B1351 verhindern sollen bleiben 1 April aufrecht hinzu kommen verschärfungen Vorarlberger Laiblachtal niederösterreichisch bezirke Wiener neustadt-land Neunkirchen ab Donnerstag ausreisetests benötigen Mittwoch geben Krisenstab bekennen 176 corona-infizierte Wien intensivmedizinisch Betreuung brauchen -- vieler nie zuvor rund 13 Million Impfung werden bisher Österreich durchführen 330000 Mensch bereits voll immunisieren Hintergrund Streit eu Astra zeneca fund 29 Million dosis corona-impfstoff Abfüllstätte Italien Verwirrung sorgen Deutschland Bundeskanzlerin Angela Merkel Land verabreden Ruhetagsregel Ostertage zurücknehmen entstanden Verunsicherung entschuldigen red 2432021 mehr_Thema_Symptom Covid-19_Grippe grippal_Infekt unterscheiden_standard-community erzählen_corona-krankheitserfahrungen Hochmuth Reuter Foeger imagebrokerjiri Hubatka via_wwwimago-imagesdefoto Apahelmut Fohringer | Handel schließen ostern danach zugangstests -- Schule Fernunterricht Ferien
2000129417401,5,﻿20corona-regeln Wiener Modell Vorlage covid-maßnahmen corona-regeln-wiener-modell-als-vorlage-fuer-covid- Massnahme Regierung beraten Mittwoch landeshauptleuten weit corona-maßnahmen Zahl neuinfektion steigen Wien -- konkret Plan pandemie-maßnahmen Herbst sagen Gesundheitsminister_Wolfgang_Mückstein_grün 31 August verraten offenbar oberösterreich sagen pflegen zizerlweise Sonntagsausgabe Krone Zeitung Österreich stellen Mückstein Raum neben Nachtgastronomie Stehpartys bei après-ski 1g-regel kommen -- geimpft teilnehmen dürfen Vorschlag Wiedereinführung Generell indoor-maskenpflicht mittlerweile groß Koalitionspartner övp vorlegen geben Mückstein bekennen Mittwoch treffen Bund landeshauptleuten möglich Maßnahme beraten hoch sonntagsweren neuinfektion seit April treffen finden angesichts steigend_Infektionszahl statt 1774 corona-infektionen bedeuten hoch Wert Sonntag seit April außerdem liegen Schnitt vergangen sieben Tag der 1564 neu Fall registrieren werden betrachten sieben-tage-inzidenz Fall pro 100000_Einwohner innerhalb Woche Bundesland liegen Wien Wert 1765 Salzburg 1616 oberösterreich 1527 dabei gelten Bundeshauptstadt bereits streng Regel Rest Land Geschäft zumindest mund-nasen-schutz tragen außerhalb Stadtgrenze Geschäft täglich Bedarf supermärken Apotheke Bank Post notwendig Test gelten kurz negativ_pcr-test 48 statt 72_Stunde gültig offiziell Teststraße absolviert Antigentest 24 statt 48_Stunde schließlich gelten 3g-regel bereits ab sechster Lebensjahr testprobleme ländlich Raum Wiener Modell bereits Vorlage Österreichweite Maßnahme ab Oktober Interview sympathisiern Mückstein verkürzen Gültigkeitsdauer negativ Test geben Bedenken Testangebote Großstadt leicht ländlich Gebiet Wien gut vergleichbar bayrisch Landeshauptstadt München liegen sieben-tage-inzidenz derzeit Wert 70 geltend Maßnahme decken Großteil wiens -- zwei Ausnahme gastronomie-innenräumen bestehen abseits tisch Maskenpflicht bestimmt hotspots 20 6 Uhr öffentlich Bereichen Konsumation gläsern Glasflasch verbieten Neo werten genesen weit Unterschied München Einsatz 3g-regel automatisch Inzidenz koppeln österreichisch Diskussion vermissen Neo derartig klar Regelung Gesundheitssprecher Gerald Loacker mahnen Sonntag Genesen vergessen mittlerweile bereits fast 659000 Mensch statt immer öfter 1 g fantasieren müssen Bundesregierung endlich definieren Antikörpertest anerkennen Schwellenwert liegen fordern Loacker Bundeskanzler_Sebastian_kurz_övp talk Spezial Servus tv sonntagabend Maßnahme festlegen Freiheitseinschränkung dürfen immer ultima ratio bevor überlastung Gesundheitssystems kommen selbstverständlich reagieren sein Zugang klar bevor Nachtgastronomie ganz schließen Hinkann lieb geimpft dürfen hingehen moe 692021 weiterlesen Kanzler kurz corona-lage Impfung lieb Lockdown Gesundheitsminister_Wolfgang Mückstein sprechen Interview möglicherweise scharf Regel Woche Regierung landeshauptleuten beraten apaherberen_Neubauer | Wiener Modell Vorlage covid-maßnahmen
2000130275144,5,﻿20 Modellregion Ampelkommission Schultest mehr Vorarlberg nötigmodellregion-ampelkommission-keine-schultests-mehr-in-vorarlberg-noetigvorarlberg erneut Modellregion Schulbetrieb weitgehend normalisieren corona-ampel liegen Bundesland orang Bereich Wien -- Ampelkommission Donnerstag ganz unterschiedlich Signal aussenden mehrere Bundesländ Farbgebung ungünstig Sektor zurückfallen Vorarlberg einzig Land schulbereich Stufe eins reihen müssen ländle Test mehr durchführen Schulbetrieb kehren mehr weniger Zustand corona zurück verhältnismäßig gering Quote Patient Intensivmedizin sowie Tatsache Richtung Bundesländ kaum arbeits- Schülermobilität kommen erlauben Bundesland Vorarlberg weit Schritt Richtung Normalisierung gehen heißen schreiben Kommission Vorarlberg neuerlich Testregion dienen schon dereinst Gastronomie Kommission hoffen entsprechend epidemiologisch Schlussfolgerunge weit normalisierungsschritte schulwesen ganz Österreich ziehen Vorarlberg Ampel Orang Vorarlberg heranziehen überraschen insofern Land corona-ampel orang Bereich aufscheinen -- hoch Risikosektor dorthin zurückfallen Steiermark Tirol umgekehrten gelb mittlerer_Risiko gehen Niederösterreich befinden Burgenland vergangen Woche gelb-grün Zone gering Risikos übrig Bundesländ verharren Gesamtstaat orang Bereich Vorarlberg Bildungslandesrätin Landesstatthalterin Barbara schöbi-fink övp erklären Aussendung Frühjahr Pilotregion normalisierungsschritte erproben gut beobachten begründen Auswahl Vorarlberg Modellregion Bundesvergleich gering sieben-tage-inzidenz vergleichsweise gering Quote covid-patienten intensivstationen sowie werten Abwasseranalyse Maskenpflicht mehr Schüler lehr- Verwaltungspersonal bestehen ab 11 Oktober Maskenpflicht mehr Geimpft Personal ändern Testpflicht geimpft genesen freiwillig antigen-tests Wunsch Land dreimal wöchentlich durchgeführen Test mehr freiwillig anbieten extern dürfen 3g-nachweis Maske Schule sollen verdachtsfälle auftreten bestehen Möglichkeit vorübergehend test beziehungsweise Maskenpflicht einzeln Klasse maximal Woche anordnen dafür brauchen Schule vorher Zustimmung Bildungsdirektion weitergetesten zudem sentinel-schulen 8102021 Schüler Schülerinn Vorarlberg müssen ab 11 Oktober Maske mehr tragen Reuter Leonhard Foeger | Ampelkommission Schultest mehr Vorarlberg nötig
