ID_GodotObject,url,author,RessortName,source,sourceCategory,ObjectType,publishingDate,titletext,content,sentiment_content,sentiment_titletext
2000127489680,/2000127489680/Maskenpflicht-Sperrstunde-und-Begrenzungen-fuer-Veranstaltungen-fallen-ab-1-Juli,(keine Angabe),Coronavirus,Redaktion,Online only,Artikel,2021-06-17 10:50:18.000,"Maskenpflicht, Sperrstunde und Begrenzungen für Veranstaltungen fallen am 1. Juli","﻿2.0ÜbersichtMaskenpflicht, Sperrstunde und Begrenzungen für Veranstaltungen fallen am 1. JuliUebersicht-Maskenpflicht-Sperrstunde-und-Begrenzungen-fuer-Veranstaltungen-fallen-am-1-JuliDas Leben wird wieder fast wie früher, nur die Drei-G-Regel bleibt überall erhalten, wo sie jetzt schon gilt<p>Wien – ""Alles, was Spaß macht, am Abend und in der Nacht, kann wieder stattfinden"", sagte Kanzler Sebastian Kurz (ÖVP) am Donnerstag bei der Verkündung der nächsten Öffnungsschritte ab 1. Juli. Er bezog sich dabei auf Aktivitäten in der Öffentlichkeit: Clubs, Kultur und Gastronomie können bald also wieder weitestgehend ohne Einschränkungen aufsperren und stattfinden – nur die Drei-G-Regel bleibt. Auch die Maskenpflicht fällt fast überall. ""Es ist wunderschön, dass wir endlich wieder zur Normalität zurückkehren können"", sagte Kurz.</p><h3>Die Lockerungen im Detail:</h3><ul><li>Die 24-Uhr-Sperrstunde in der <strong>Gastronomie </strong>wird abgeschafft – das ermöglicht die Öffnung von Clubs. Die Auslastung ist dort bis zum 22. Juli noch auf 75 Prozent beschränkt. Darüber hinaus muss in Lokalen gar keine Maske mehr getragen werden. Die Kundenregistrierung bleibt ebenfalls noch bis 22. Juli aufrecht. </li><li>Auch <strong>Großveranstaltungen </strong>""werden wieder uneingeschränkt möglich sein"", erklärte Kurz. Es werde dort weder Maskenpflicht noch Beschränkungen bei der Größe des Publikums geben – nur die Drei-G-Regel gilt weiterhin, Gäste müssen also getestet, geimpft oder genesen sein. Veranstaltungen ab 100 Personen müssen gemeldet, ab 500 Personen müssen sie bewilligt werden. </li><li>Die <strong>Maskenpflicht </strong>wird zu großen Teilen aufgehoben. FFP2-Masken sind ab 1. Juli nur noch in Krankenhäusern und Pflegeheimen vorgeschrieben. In öffentlichen Verkehrsmitteln, im Handel und in Museen muss ein Mund-Nasen-Schutz (MNS) getragen werden. Ab 22. Juli gilt die MNS-Pflicht überhaupt nur noch in Öffis und in Geschäften des täglichen Bedarfs.</li><li>Auch <strong>Abstandsregeln und Quadratmeter-Beschränkungen</strong> werden ab 1. Juli gänzlich aufgehoben, das gilt für alle Bereiche. Auch alle weiteren Kontaktbeschränkungen fallen, Menschen dürfen also wieder treffen, wen sie wollen.</li></ul><h3>Mückstein: Solidarisch mit der Jugend sein</h3><p>Die Schritte seien vor allem für die Jugend sehr wichtig, sagte Gesundheitsminister Wolfgang Mückstein (Grüne): ""Jetzt seids ihr dran, jetzt öffnen die Clubs endlich, jetzt kann es die Festivals geben. Jetzt liegt es an uns, mit den Jungen solidarisch zu sein.""</p><p>Tourismusministerin Elisabeth Köstinger (ÖVP) erkennt in den Schritten ""auch ein wirtschaftliches Aufatmen"" für viele hart getroffene Betriebe und Branchen. Dass ab 1. Juli auch in Innenräumen keine Maskenpflicht mehr gilt, sei positiv für Tourismus und Gastronomie, ""weil vor allem auch das Lächeln der Servicemitarbeiter durchaus Freude bereitet"". Die Wiederermöglichung von Hochzeiten sei ein wichtiger Schritt, denn ""es warten mehrere Tausend Hochzeitspaare auf den schönsten Tag ihres Lebens"". Aber auch für Messen, Kongresse und andere Veranstaltungen wird es leichter, weil Quadratmeterregeln fallen.</p><h3>Buchen in Österreich</h3><p>Die Buchungslage im österreichischen Tourismus sei aktuell ""hervorragend"", dennoch ruft Köstinger dazu auf, diesen Sommer in Österreich zu verbringen. ""Sollte es Sie doch ans Meer ziehen, bitte unbedingt bei einem österreichischen Reisebüro buchen"", denn ""nur dort gibt es dann entsprechend Stornomöglichkeiten und eine Reiseversicherung"", sagte Köstinger. Stornomöglichkeiten und Reiseversicherungen gibt es freilich auch bei Anbietern außerhalb Österreichs.</p><p>Kulturstaatssekretärin Andrea Mayer (Grüne) betonte, dass Popkultur, Subkulturen und Clubkulturen allesamt ""essenzielle Teile unserer Kulturlandschaft in Österreich"" seien. Und ""ab 1. Juli können alle Veranstaltungen, egal ob Sitzplatz oder Stehplatz, ob drinnen oder draußen, wieder ohne Publikumsbegrenzungen und ohne Kapazitätsbegrenzungen stattfinden"". Auch die Maskenpflicht fällt bei Indoorveranstaltungen.</p><h3>Impfung wirkt auch gegen Delta-Variante</h3><p>Oswald Wagner, Vizerektor der Med-Uni Wien, bekräftigte stellvertretend für die zurate gezogenen Expertinnen und Experten, dass die Öffnungsschritte ""absolut vertretbar sind"". Dennoch dürfe man nicht übermütig werden: ""Wir müssen noch ein bisschen vorsichtig bleiben"", zumal die Delta-Variante des Coronavirus auch in Österreich auf dem Vormarsch ist. ""Sie wird sich auch bei uns ausbreiten."" Die gute Nachricht sei aber, dass die Impfung auch gegen diese Mutation wirke.</p><p>Die Entspannung wollte sich Kurz auch auf Nachfrage nicht nehmen lassen: ""Solange der Herr Vizerektor nicht anruft und sagt: Es gibt eine Mutation, bei der die Impfung nicht mehr wirkt, werden wir entspannt, aber vorsichtig sein."" Der Weg zurück zur Normalität ""wird so stattfinden"".</p><h3>Eigenverantwortung in der vierten Welle</h3><p>Mit Blick auf den Herbst skizzierte Kurz eine Phase verstärkter Eigenverantwortung, auch dann, wenn der saisonale Effekt nachlässt und eine vierte Welle eintritt: Denn weil jeder, der das will, sich bis dahin impfen lassen kann, brauche es dann weniger allgemeine Einschränkungen: ""Wenn sich jemand nicht impfen lässt, nimmt er ein individuelles Risiko in Kauf"", sagte der Kanzler. Das sei jedem überlassen, aber ""es wird nicht möglich sein, dass die Gesellschaft sich deshalb auf Dauer einschränkt"". (sefe, 17.6.2021)</p><p>Die Regierung lockert.</p><p>Symbolbild mit Vorschaucharakter: Party!</p>DER STANDARD<script class=""podigee-podcast-player"" src=""https://player.podigee-cdn.net/podcast-player/javascripts/podigee-podcast-player.js"" data-configuration=""https://themadestages.podigee.io/489-neue-episode/embed?context=external""></script>Neuer HTML TagFoto: AFP/Kevin DietschFoto: apa / roland schlager",5.472103004291954e-06,-0.020009090909090907
2000127830758,/2000127830758/Kurz-rechnet-mit-steigenden-Infektionszahlen,(keine Angabe),Coronavirus,APA,Agentur,Artikel,2021-06-30 10:48:03.000,Kurz rechnet mit steigenden Infektionszahlen,"﻿2.0PandemiebekämpfungKurz rechnet mit steigenden InfektionszahlenPandemiebekaempfung-Kurz-rechnet-mit-steigenden-InfektionszahlenSchlüssel für die Pandemiebekämpfung sei die Impfung. Auch Gesundheitsminister Mückstein warnt, dass die Pandemie noch nicht vorbei ist<p>Wien – Für Bundeskanzler Sebastian Kurz (ÖVP) ist der Schlüssel der Pandemiebekämpfung die Corona-Impfung. An jene, die sich nicht impfen lassen möchten, hatte der Kanzler im Pressefoyer nach dem Ministerrat am Mittwoch eine Botschaft: ""Bitte seien Sie sich bewusst, dass die Ansteckungszahlen wieder steigen werden."" Die Pandemie sei nur für jene vorbei, die sich impfen lassen. Impfstoff sei ""kein knappes Gut"" mehr. Gegen eine Impfpflicht ist der Kanzler aber weiterhin.</p><p>Positiv sieht Kurz den Impffortschritt. Knapp 7,5 Millionen Impfungen seien mittlerweile durchgeführt worden. Das sei mehr, als zu diesem Zeitpunkt erwartet worden sei. Trotz aller Begeisterung: <a href=""/story/2000127821469/fuenf-millionen-bis-ende-juni-impfziel-wird-nur-knapp-nicht"">Das Impfziel von fünf Millionen Erstimpfungen bis Ende Juni hat Österreich knapp verpasst</a>.</p><h3>Keine Goodies für Impfungen</h3><p>Die Regierung plant aktuell keine Gutscheine oder sonstige Goodies, um mehr Österreicher zu einer Impfung zu bewegen. ""Die beste Motivation ist Aufklärung"", meinte dazu Gesundheitsminister Wolfgang Mückstein (Grüne) am Mittwoch nach dem Ministerrat. Auch  Kurz zeigte sich skeptisch, ob es richtig sei, die Menschen für die Impfung zu bezahlen.</p><p>Wie der Regierungschef im Pressefoyer betonte, würden ohnehin sehr viele niederschwellige und kostenlose Angebote vom Steuerzahler finanziert, von den Gratis-Tests bis zur Impfung, für die nichts zu bezahlen sei. Lokale kreative Ideen, wie man Menschen motivieren könne wie zuletzt etwa mit einer Immunisierung beim Wirtshaus-Besuch in einem oberösterreichischen Bezirk, unterstütze man aber.</p><h3>Taskforce gegen Corona</h3><p>""Guten Gewissens"" kämen im Juli Öffnungsschritte, sagte Kurz. Bei der Maskenpflicht gelte wie im vergangenen Jahr die Pflicht zum Mund-Nasen-Schutz. FFP2-Masken könnten aber weiter verwendet werden. Kurz sprach von einem ""Prinzip der Freiwilligkeit"".</p><p>Kurz kündigte auch an, dass eine Taskforce über den Sommer die Corona-Situation beobachten und Vorbereitungen für den Herbst treffen soll. Neben dem Bundeskanzler sollen Vizekanzler Werner Kogler, Gesundheitsminister Mückstein, Ministerien wie Tourismus, Kultur, Außen- und Landesverteidigung, Vorsitzende der Landeshauptleutekonferenz und Experten an der Taskforce beteiligt sein.</p><h3>Mückstein: ""Wird ein sicherer Herbst""</h3><p>Mückstein sprach beim selben Termin über die Motivation hinter den Öffnungsschritten: ""Wir haben den Jüngeren in unserem Land etwas versprochen"", sagte der Gesundheitsminister. Die Jungen hätten auf vieles verzichtet. Die Lage sei gut, man könne den Jungen nun ein Stück weit ihr ""altes Leben"" zurückgeben. Mückstein betonte aber: ""Natürlich ist die Pandemie nicht vorbei."" Die Lösung könne jedoch nicht sein, Versprechen nicht zu halten. Jenen, die die Verbreitung der Delta-Variante Sorge macht, sagte Mückstein, dass die Vorbereitungen für den Herbst laufen. ""Es wird ein sicherer Herbst werden.""</p><p>Tourismusministerin Elisabeth Köstinger (ÖVP) sieht die Öffnungsschritte positiv. Die Buchungslage sei derzeit ""sehr positiv"". Hochrechnungen zeigten eine Auslastung von 70 Prozent im Juli. Sorgenkind bleibe aber die Stadthotellerie. ""Es fehlen internationale Gäste"", so Köstinger. (agr, 30.6.2021)</p><p><strong>Weiterlesen:</strong></p><p><a href=""/story/2000127826838/komplettes-aus-der-maskenpflicht-am-22-juli-spaltet-die-tuerkis"">Komplettes Aus der Maskenpflicht am 22. Juli spaltet die türkis-grüne Regierung</a></p><p><a href=""/story/2000127820154/finalspiele-als-superspreader-events"">Finalspiele als Superspreader-Events?</a></p><p><a href=""/story/2000127824611/forscher-entwickeln-maske-die-covid-19-infektion-erkennen-kann"">Forscher entwickeln Maske, die Covid-19-Infektion erkennen kann</a></p><p>Auch wenn die Infektionszahlen gerade sinken, warnt Bundeskanzler Sebastian Kurz (ÖVP), dass die Pandemie noch nicht vorbei sei.</p>Foto: APA / Helmuth Fohringer",-0.00011830065359477105,0.0008
2000127874486,/2000127874486/Corona-Was-bei-Urlaubsreisen-nach-Griechenland-zu-beachten-ist,(keine Angabe),Coronavirus,Redaktion,Online only,Artikel,2021-07-02 11:28:37.000,Corona: Was bei Urlaubsreisen nach Griechenland zu beachten ist,"﻿2.0ServiceCorona: Was bei Urlaubsreisen nach Griechenland zu beachten istService-Corona-Was-bei-Urlaubsreisen-nach-Griechenland-zu-beachten-istReisende berichten, dass die Corona-Papiere im Land der Helleninnen und Hellenen penibel kontrolliert werden – jedenfalls bei der Einreise<p>Griechenland war immer das Land der Bürokratie, gemildert durch Schlamperei. Wie ist das im Zeichen der Covid-Vorschriften? Recht ungriechisch, berichten Reisende in der letzten Juniwoche.</p><p>Wichtig sind zwei Dinge: Erstens das online ausgefüllte EU Passenger Location Formular (EUPLF) – muss für einige EU-Länder ausgefüllt werden, wird in Griechenland aber genau kontrolliert; man muss sich spätestens 24 Stunden vor Reiseantritt über <a href=""http://gr.travel.gov"" target=""_blank"">gr.travel.gov</a>. registrieren (Tipp: Flugnummer und Postleitzahl des Ferienortes bereithalten!). Man bekommt dann knapp vor der Reise per E-Mail oder SMS einen QR-Code (ausdrucken oder aufs Handy).</p><p>Zweitens das Impfzertifikat. Gespeichert am Handy oder ausgedruckt (Download von <a href=""https://www.gesundheit.gv.at/"" target=""_blank"">gesundheit.gv.at</a> mit E-Signatur oder von Stadt Wien, nur mit PIN des letzten Tests …). Seit 1. Juli grüner EU- Pass. Der gelbe Papierimpfpass geht aber auch.</p><p>Bei einem Aegean-Flug von Wien nach Athen steht eine Mitarbeiterin vor der Gepäckaufgabe und kontrolliert genau den QR-Code des PLF und das Impfzertifikat (bzw. Test oder Genesenenbescheinigung). Drei junge Damen in Ferienstimmung, die dachten, sie könnten das PLF jetzt erst ausfüllen, wurden weggeschickt – Schicksal ihrer Reise unbekannt.</p><p>Bei der Ankunft in Athen erneut Prüfung von QR-Code und Impfzeugnis (""Wann war die zweite Impfung?""). Ratsam ist es, die Dinge bereitzuhalten, wenn man nicht die Wut in der Schlange spüren will.</p><p>Bei Inlandflügen in Griechenland, etwa auf die Inseln, folgt abermals die Kontrolle von QR- Code und Impfpass, bei Abflug und Ankunft. Bei online gebuchten Tickets für Fähren wird ein ""pre boarding health declaration questionnaire"" verlangt, aber nicht strikt kontrolliert. Auf den Fähren wird Maskenpflicht kontrolliert.</p><p>So viel zu Individualreisen. Es gibt aber Unterstützung durch Reiseveranstalter. Die Austrian Airlines bieten derzeit für 13 Länder (darunter auch Griechenland) sowohl für Linien- als auch für Charterflüge eine digitale Dokumentenprüfung an. Man kann hierbei freiwillig rechtzeitig vor Reiseantritt alle benötigen Dokumente hochladen. Diese werden anschließend vom Health Entry Support Center auf Vollständigkeit und Richtigkeit überprüft.</p><p>Der Fluggast erhält per E-Mail eine Benachrichtigung, ob alle Dokumente gültig und vollständig sind oder ob weitere Unterlagen nachgereicht werden müssen. Die von Griechenland oder vom jeweiligen Reiseland vorgeschriebenen Dokumente werden von Austrian-Mitarbeitern zusätzlich auch am Flughafen kontrolliert. (red, 1.7.2021)<br></p><p>Erst Bürokratie, dann Urlaub.</p>Foto: AP Photo/Petros Giannakouris",-0.0010073593073593075,0.0
2000128070755,/2000128070755/Hohe-Wahrscheinlichkeit-fuer-vierte-Welle-in-Oesterreich,(keine Angabe),Coronavirus,APA,Agentur,Artikel,2021-07-09 07:18:28.260,Hohe Wahrscheinlichkeit für vierte Welle in Österreich,"﻿2.0Coronavirus""Hohe Wahrscheinlichkeit"" für vierte Welle in ÖsterreichCoronavirus-Hohe-Wahrscheinlichkeit-fuer-vierte-Welle-in-OesterreichAmpelkommission und Covid-Prognose-Konsortium führen die Delta-Variante als Grund an. Bei einem Infektionsanstieg empfiehlt das Konsortium die Wiedereinsetzung von Maßnahmen<p>Wien – Die Ampelkommission wie auch das Covid-Prognose-Konsortium sehen aufgrund der Delta-Variante eine ""hohe Wahrscheinlichkeit"" für eine vierte Corona-Welle. Offen sind der Zeitpunkt des Eintreffens und das Ausmaß. Im Fall des Falles empfiehlt das Konsortium auch die Wiedereinsetzung von Maßnahmen wie verstärkte Maskenpflicht oder auch Social Distancing.</p><h3>""Oberste Priorität"" für hohe Durchimpfungsrate</h3><p>In der Endversion eines Positionspapiers des Prognosekonsortiums zur Risikobewertung der Delta-Variante, das das Konsortium im Auftrag des Gesundheitsministeriums erstellt hat, heißt es, dass die Maximierung der Durchimpfungsrate (Vollimmunisierung) ""oberste Priorität"" haben müsse.</p><p>In dem der APA ebenfalls vorliegenden Rohbericht des Briefes wird darüber hinaus auch eine Wiedereinführung diverser Maßnahmen – abhängig von den Fallzahlen und den Belastungen des Gesundheitssystems empfohlen. Die (aktuell in breiten Bereichen abgeschafften) FFP2-Maskenpflicht sollte demnach ab einem Schwellenwert einer risiko-adjustierte Sieben-Tages-Inzidenz von 25 wieder eingeführt werden. Derzeit liegt man mit zuletzt 7,3 Fälle pro 100.000 Einwohner freilich darunter – die Schwelle von 25 war am 6. Juni unterschritten worden.</p><h3>Delta-Variante um 50 Prozent ansteckender</h3><p>Bei steigenden Hospitalisierungen auf den Normalstationen wird auch die Wiedereinführung des Social Distancing angeraten, etwa die Wiedereinführung des Zwei-Meter-Abstandes. Im Fall eines kontinuierlichen Ansteigens der Covid-Patienten auf den Intensivstationen, was aus derzeitiger Sicht als wenig wahrscheinlich gilt, wird auch neuerlich ein Lockdown light in Betracht gezogen, unter anderem mit erneuter Schließung von Freizeiteinrichtungen und Einschränkungen bei Zusammentreffen. Ein echter Lockdown wird nur bei einer Annäherung an eine ""systemkritische"" Auslastung der Intensivstationen empfohlen.</p><p>Sowohl im Rohbericht als auch in der Endversion betonte das Konsortium, dass sich anhand vorliegender Daten – vor allem aus Großbritannien – festhalten lasse, dass ""die Delta-Variante deutlich übertragbarer als die bisher dominante Alpha-Variante (B.1.1.7) ist"". Erste Schätzungen würden auf eine Transmissibilität hindeuten, die etwa um 50 Prozent höher im Vergleich zur bisher dominanten Alpha-Variante sei. ""Im Vereinigten Königreich ist die Delta-Variante derzeit mit einer Prävalenz von über 90 Prozent bereits dominant"", hieß es.</p><h3>Vorsicht geboten</h3><p>Die Experten rechnen bereits im Juli mit ""ähnlichen Prävalenzen"" wie im Vereinigten Königreich. Dies sieht auch die Virologin Monika Redlberger-Fritz von der Med-Uni Wien so: ""Das ist wahrscheinlich die Ruhe vor dem Sturm"", sagte sie in der ""ZiB 2"" des ORF am Donnerstagabend zur aktuellen Situation. Auch sie betonte die Notwendigkeit einer hohen Durchimpfung – denn in Großbritannien sehe man aktuell, dass zwar die Fallzahlen stark ansteigen, dank der hohen Impfrate aber die Zahl der Hospitalisierungen nur ""ganz, ganz langsam"" mitziehe.</p><p>Sehr skeptisch zeigte sich die Expertin, was allfällige Großveranstaltungen wie etwa Musikfestivals betrifft: Dies sei nur mit ""äußerster Vorsicht"" möglich, am besten wäre es weiterhin, möglichst Abstand zu halten. Klare Ablehnung kam für einen von Bundeskanzler Sebastian Kurz (ÖVP) ins Spiel gebrachten Wegfall der Maskenpflicht in Handel oder öffentlichen Verkehrsmitteln. ""Ich bin eine sehr starke Befürworterin des Maskentragens.""</p><p>Trotz der erwarteten raschen Zunahme der Delta-Variante mit Austausch der gegenwärtig dominierenden Alpha-Variante in Österreich rechnet das Konsortium auf Sicht nicht mit allzu großen Problemen: ""Ein systemkritischer Belag in den Krankenanstalten ist im Sommer 2021 jedoch unwahrscheinlich.""</p><h3>Intensivstationen aktuell nicht gefordert</h3><p>Die Erhöhung der Durchimpfungsrate und der Impfbereitschaft in allen Bevölkerungsgruppen sei aber essenziell, denn: ""Bei einer Durchimpfungsrate (Vollimmunisierung) von 70 Prozent ist der hypothetische Schwellwert der Herdenimmunität für die Delta-Variante noch nicht erreicht, insbesondere in der kälteren Jahreszeit."" Selbst bei einer Durchimpfungsrate von 70 Prozent (Vollimmunisierung) oder höher sei ""davon auszugehen, dass es in Bevölkerungsgruppen mit geringer Durchimpfung zu größeren Clustern oder zur unkontrollierten Übertragung in diesen Bevölkerungsgruppen kommen kann"".</p><p>Die Ampelkommission teilte diese Einschätzung hinsichtlich einer vierten Welle – noch aber ist laut deren Daten die Lage ruhig. Die Covid-spezifische Belastung der Intensivstationen sank zuletzt auf 2,2 Prozent und dürfte vorläufig weiter nach unten gehen. Die Durchimpfungsrate hat ein Niveau von 62 Prozent erreicht. Auch die Kommission pocht ehestmöglich auf Maßnahmen, diesen Wert nach oben zu drücken.</p><p>Die Corona-Ampel erfuhr indes diese Woche kaum eine Farbänderung. Nur Vorarlberg rückte in die grüne Zone, die sehr geringes Ansteckungsrisiko ausdrückt. Damit befinden sich bloß noch die drei östlichen Bundesländer Wien, Niederösterreich und das Burgenland ebenso wie der Gesamtstaat in der gelb-grünen Zone, die für geringes Risiko steht. (APA, 9.7.2021)</p><p><em>In einer älteren Textversion war von einer Sieben-Tage-Inzidenz von 253 die Rede, tatsächlich beläuft sich die vom Konsortium genannte Schwelle auf 25 – der Fehler wurde behoben.</em></p><p>Pop-up-Impfzentren wie hier in Linz sollen die Impfbereitschaft erhöhen.</p>Foto: FOTOKERSCHI.AT/WERNER KERSCHBAUMORFVirologin Monika Redlberger-Fritz von der MedUni Wien über den Kreuzimpfungen, den Impfschutz bei der Delta-Variante und die Möglichkeit von Großveranstaltungen im Sommer.",-0.005126480836236934,0.0005714285714285715
