ID_GodotObject,url,author,RessortName,source,sourceCategory,ObjectType,publishingDate,titletext,content,sentiment_content,sentiment_titletext
2000115059032,/2000115059032/Maskenpflicht-fuer-medizinisches-Personal-im-Umgang-mit-Coronavirus,(keine Angabe),Coronavirus,Redaktion,Online only,Artikel,2020-02-26 16:50:27.000,Maskenpflicht für medizinisches Personal im Umgang mit Coronavirus,"﻿2.0Sars-CoV-2Maskenpflicht für medizinisches Personal im Umgang mit CoronavirusSars-CoV-2-Maskenpflicht-fuer-medizinisches-Personal-im-Umgang-mit-CoronavirusIm Labor müssen Proben von potenziell infizierten Personen als ansteckungsgefährlicher Stoff deklariert werden<p>Wien – Obwohl sich inzwischen herumgesprochen haben sollte, dass einfache Mundschutzmasken in Zeiten des Coronavirus keine Ritterrüstung sind, sind auch Papierprodukte im Handel immer wieder ausverkauft. Fachleute raten nicht generell davor ab, weil Infizierte damit immerhin theoretisch das Risiko verringern, andere durch Tröpfchenübertragung (Husten, Niesen, feuchte Aussprache) anzustecken.</p><p>Auf der gesunden Gegenseite schützt ein Mundschutz ohne Partikelfilter aber so gut wie nicht vor einer Infektion. Außerdem zupfen ungeübte Maskenträger, und das ist die Mehrheit der Bevölkerung, häufig an Masken herum und berühren dabei oft erst recht wieder den Mund- oder Nasenbereich. Falls Sars-CoV-2 schon auf den Fingern sitzt, haben es die Viren also nicht mehr weit zu den Schleimhäuten.</p>... und einfacher Mundschutz, der nicht vor einer Infizierung schützt.<h3>Partikelfiltrierende Halbmasken</h3><p>Für medizinisches Personal hingegen besteht im Umgang mit Coronavirus-verdächtigen Menschen oder Sekretproben Maskenpflicht. Die staatliche Agentur für Gesundheit und Ernährungssicherheit GmbH (AGES) empfiehlt neben Schutzmantel, Einmalhandschuhen und Schutzbrille eine Atemschutzmaske der Kategorie FFP2, besser FFP3. Das Kürzel FFP steht für ""filtering face piece"", es handelt sich um partikelfiltrierende Halbmasken, die Mund und Nase bedecken.</p><p>FFP3-Masken filtern 99 Prozent aller Partikel bis zu einer Größe von 0,6 Mikrometern. Damit schützen sie vor krebserregenden Stoffen und Krankheitserregern wie Viren, Bakterien und Pilzsporen. Generell schützen diese Atemschutzmasken vor lungengängigem Staub, Rauch und Aerosolen. Vor Dampf und Gas schützen sie nicht.</p><p><strong>""Biologischer Stoff, Kategorie B""</strong></p><p>Nach einer Probenentnahme aus Nase und Rachen von möglicherweise infizierten Personen muss die komplette Schutzkleidung umgehend entsorgt werden. Die Transportbox für das Probenröhrchen muss gemäß den Anleitungen der AGES mit ""Biologischer Stoff, Kategorie B"" gekennzeichnet werden, dadurch wissen Labormitarbeiter, dass es sich um einen ansteckungsgefährlichen Stoff handelt.</p><p>In die Kategorie A fallen biologische Stoffe, die bei Austritt aus der Schutzverpackung und physischem Kontakt bei Menschen oder Tieren eine dauerhafte Behinderung oder eine lebensbedrohende oder tödliche Krankheit hervorrufen können. (simo, 27.2.2020)</p><p>Hochwertige Atemschutzmaske für medizinisches Personal ...</p>Foto: ImagoFoto: EPA / Angelo Garconi",-0.0061645994832041345,0.0
2000116305030,/jetzt/livebericht/2000116305030/regierung-zieht-bilanz-ueber-bisherige-massnahmen,(keine Angabe),Coronavirus,Redaktion,Online only,LiveBericht,2020-03-30 05:36:31.240,Schrittweise Einführung von Maskenpflicht in der Öffentlichkeit,"﻿2.0CoronavirusSchrittweise Einführung von Maskenpflicht in der ÖffentlichkeitCoronavirus-Schrittweise-Einfuehrung-von-Maskenpflicht-in-der-OeffentlichkeitDie Regierung hat die Corona-Maßnahmen weiter verschärft. In der ""ZiB Spezial"" dämpfte der Kanzler erneut die Hoffnung auf eine schnelle Rückkehr zur Normalität<p><strong>Das Wichtigste in Kürze:</strong></p><ul><li>Die Regierung zog in einer Pressekonferenz eine erste Bilanz der bisherigen Maßnahmen gegen die Ausbreitung des Coronavirus. Sebastian Kurz: ""Es ist die Ruhe vor dem Sturm."" Drei Maßnahmen werden laut dem Bundeskanzler zusätzlich ergriffen: <strong>G</strong><b>efährdete Personen sollen besser geschützt werden,</b> die Regierung will die <b>bisherigen Maßnahmen konsequent kontrollieren</b> und auf <b>Masken in der Öffentlichkeit setzen.</b> Supermarktketten werden das Verteilen der Masken voraussichtlich <b>ab Mittwoch</b> organisieren, jedenfalls sobald Masken in ausreichender Zahl im Land sind.</li><li><strong>Gefährdete Personengruppen </strong>werden zusätzlich <strong>beruflich freigestellt</strong> oder müssen <strong>verpflichtend ins Homeoffice.</strong></li><li>Die <strong>touristische Nutzung von Hotels</strong> wird untersagt.</li><li>Die <strong>Schutzkonzepte der Spitäler</strong> werden ausgebaut. </li><li>Derzeit findet eine <strong>Stichprobentestung bei 2.000 Personen statt.</strong> Damit werde man Ende der Woche abschätzen können, wie viele Personen tatsächlich infiziert sind. Auch beim medizinischen Personal werden entsprechende Testungen durchgeführt.<br></li><li>Es habe allein am Wochenende <strong>2.046 Anzeigen</strong> wegen Verstößen gegen die Coronavirus-Maßnahmen gegeben. Kurz: ""Wir sind weit entfernt von einer Lockerung der Maßnahmen."" Sobald dies möglich ist, werden <strong>Geschäfte zuerst geöffnet,</strong> so der Kanzler. Erst danach sollen Schulen und Unis folgen.<br></li><li>Mit Stand <strong>Montag, 10.30 Uhr, </strong>sind laut Gesundheitsminister Rudolf Anschober und Innenminister Karl Nehammer österreichweit <strong>108 Personen</strong> an den Folgen des Coronavirus <strong>gestorben</strong> und <strong>636 wieder genesen.</strong> Insgesamt wurden <b>618 </b><strong>Menschen </strong>in Österreich <strong>positiv</strong> auf das Virus <strong>getestet </strong>(Quelle: Dashboard des Gesundheitsministeriums per Stand 23 Uhr).</li><li>Von <strong>15. bis 29. März wurden 179.000 Menschen arbeitslos</strong> gemeldet. Am 16. März traten die Maßnahmen gegen das Coronavirus in Kraft. </li><li>Das Donauinselfest wird auf September verschoben, der traditionelle SPÖ-Maiaufmarsch in Wien wird abgesagt.</li><li>Die USA verzeichnen mit über 142.000 Corona-Fällen <b>weltweit die meisten Erkrankungen.</b> US-Präsident Trump hat am Sonntag angekündigt, dass die aktuell geltenden Maßnahmen bis 30. April verlängert werden. <a href=""/story/2000116298711/new-york-ist-in-der-corona-krise-schon-wieder-ground""><b>New York steht vor einer Katastrophe</b></a>. Trump befürchtet 100.000 Coronavirus-Tote in den USA.</li><li>Das Land <b>Niederösterreich</b> lässt am Montag <a href=""/jetzt/livebericht/2000116260634/redcontent/1000184779/mehr-als-7-600-infizierte-in-oesterreich-grosslieferungen-von-schutzausruestung?isadminview=true&amp;responsive=false"" target=""_blank"" rel=""noopener noreferrer""><b>250 Pflegerinnen und Pfleger aus Rumänien und Bulgarien einfliegen</b></a><b>. </b>Nach einer 14-tägigen Quarantäne sollen sie bis zu sechs Wochen lang in Österreich arbeiten können. Die Kosten für den Flug und die Unterbringung während der Quarantänezeit tragen das Land Niederösterreich beziehungsweise die Wirtschaftskammer – wenn die Betreuerinnen in Niederösterreich tätig sind.</li><li>Die wichtigste Corona-Regel lautet: <b>Bleiben Sie so weit wie möglich zu Hause,</b> schränken Sie Ihre Sozialkontakte ein. Einkaufen, um die Grundversorgung zu gewährleisten, ist gestattet, der Aufenthalt im öffentlichen Raum nur allein oder mit Personen aus einem gemeinsamen Haushalt. Halten Sie die Abstandsregel von mindestens einem Meter ein.<br><br></li></ul><h3><b>Weitere Informationen</b></h3><p>Die <b>Ages</b> beantwortet Fragen rund um das Coronavirus unter der Nummer <b>0800 555 621.</b> Sollten Sie <b>Symptome</b> aufweisen, rufen Sie bei der landesweit gültigen <b>Gesundheitshotline 1450</b> an.</p><p><a href=""/story/2000115667995/die-wichtigsten-fragen-und-antworten-zum-coronavirus"">Die wichtigsten Fragen und Antworten zum Coronavirus</a></p><p><a href=""/story/2000115810293/aktuelle-zahlen-zum-coronavirus"">Die aktuellen Zahlen zum Coronavirus</a></p><p><a href=""/story/2000115809846/podcast-coronavirus-lockdown-unser-neues-leben-in-der-isolation"">Podcast: Coronavirus-Lockdown – unser neues Leben in der Isolation</a></p><p><a href=""/story/2000115678028/richtiges-verhalten-in-heimischer-quarantaene"">Richtiges Verhalten in heimischer Quarantäne</a></p><p><a href=""https://www.ages.at/themen/krankheitserreger/coronavirus/"" target=""_blank"">Aktuelle Covid-19-Situation in Österreich (Ages)</a></p><p><a href=""https://www.sozialministerium.at/Informationen-zum-Coronavirus/Neuartiges-Coronavirus-(2019-nCov).html"" target=""_blank"">Bestätigte Fälle und Testungen in Österreich (Gesundheitsministerium)</a></p><p><a href=""https://www.integrationsfonds.at/newsbeitrag/covid-19-mehrsprachige-informationen-zu-wichtigen-hygiene-und-verhaltensregeln-5339"" target=""_blank"">Hinweise zur Situation und Verhaltensregeln in mehreren Fremdsprachen (Integrationsfonds)</a></p><p>(red, 29.3.2020)</p>Foto: APA/BARBARA GINDLFoto: EPA/CHRISTIAN BRUNAFoto: AP/Ronald ZakFoto: apa/schlagerFoto: Georg Hochmuth/Pool via REUTERSFoto: APA/HERBERT PFARRHOFERAP Photo/Patrick SemanskyFoto: REUTERS/Leonhard FoegerFoto: EPAFoto: APA/EXPA/ JOHANN GRODERFoto: AP Photo/Bebeto Matthews",0.0012567331670822943,0.0
2000116325081,/2000116325081/Regierung-stellt-weitere-Coronavirus-Massnahmen-vor,(keine Angabe),Coronavirus,Redaktion,Online only,Artikel,2020-03-30 13:17:32.120,"Regierung setzt auf Masken beim Einkauf, Tests und Freistellungen für Risikogruppen","﻿2.0Kein Ende in SichtRegierung setzt auf Masken beim Einkauf, Tests und Freistellungen für RisikogruppenKein-Ende-in-Sicht-Regierung-setzt-auf-Masken-beim-Einkauf-Tests-und-Freistellungen-fuer-RisikogruppenAm Montag wurden neue Maßnahmen zur Eindämmung des Coronavirus vorgestellt. ""Wir sind von unserem Ziel noch weit entfernt"", sagt der GesundheitsministerAusschnitte aus der Pressekonferenz im Video.<p>Die Bundesregierung hat am Montag im Rahmen einer Pressekonferenz weitere Maßnahmen zur Eindämmung des Coronavirus verkündet. Es gelte nun, eine Überforderung des Gesundheitssystems mit allen Mitteln zu verhindern, sagte Bundeskanzler Sebastian Kurz (ÖVP). Dies solle durch den <strong>verstärkten Schutz besonders gefährdeter Gruppen</strong>, die <strong>konsequente Durchsetzung der Maßnahmen durch die Exekutive</strong> und <strong>das verpflichtende Tragen von Masken</strong> erreicht werden. ""Wir sind von unserem Ziel noch weit entfernt"", sagte Gesundheitsminister Rudolf Anschober (Grüne). Ein Ende der Maßnahmen sei demnach noch länger nicht in Sicht.</p><p>Um den Schutz von älteren Menschen und den von Menschen mit Vorerkrankungen zu verbessern, sollen diese Bevölkerungsgruppen <strong>verpflichtend vom Job freigestellt oder auf Homeoffice umgestellt</strong> werden, erklärte Anschober. Per Erlass wird außerdem die <strong>touristische Nutzung von Hotels eingestellt</strong>. Weiters soll, vor allem zu <strong>Stoßzeiten, die Einhaltung der Sicherheitsabstände in Supermärkten verbessert</strong> werden. Etwa durch Bodenmarkierungen vor den Kassen und Kontrollen, wie viele Käufer in den Supermarkt dürfen.</p>In Zukunft müssen Masken in Supermärkten verpflichtend getragen werden.<h3>Einige Neuigkeiten beim Einkauf im Supermarkt</h3><p>In den Supermärkten soll auch die <strong>Verteilung der Schutzmasken</strong> stattfinden, deren <strong>Tragen in Zukunft beim Einkauf verpflichtend</strong> sein wird.  <strong>Ab Mittwoch</strong> sollen die Masken am Eingang der Supermärkte verteilt werden. Wer dies verweigert, ""wird nicht in den Supermarkt hineinkommen"", sagte Kurz. Die Masken sind laut Anschober dafür geeignet, dass andere nicht angesteckt werden. ""Sie haben einen Wirkungszeitraum von vier Stunden"" und dienten dem ""Schutz der Kapazitäten in den Spitälern"". So weit möglich soll dieser Schutz auch überall sonst angelegt werden, wo Menschen zusammenkommen. Finanziert sollen die Masken von den Handelsunternehmen werden.</p><p>Die Maskenpflicht gilt sowohl für Kunden als auch für Angestellte. Letztere werden außerdem dazu verpflichtet, Handschuhe zu tragen. Einlass in Geschäftslokale gibt es in Zukunft nur noch für Einzelpersonen und man muss durchgehend <strong>Einkaufswägen benützten</strong>, um den Sicherheitsabstand sicherzustellen. Außerdem soll es bald eine <strong>festgelegte Anzahl von Kunden pro Quadratmeter</strong> geben und weitere Personen erst dann hineindürfen, wenn andere die Geschäftslokale verlassen haben.</p><h3>Stichprobentestung soll Datenlage verbessern<br></h3><p>Was die Testungen angeht, arbeite die Regierung nach wie vor daran, ""dass es einen schrittweisen Ausbau gibt"". Jedoch habe man ""da durchaus eine angespannte Situation"", sagte Anschober in Bezug auf die Testkapazitäten. Bei den Antikörpertests mache ""die Industrie ganz große Fortschritte"". Diese sollen ""in einem überschaubaren Zeithorizont breit"" ausgerollt werden.</p><p>Weiters erklärte Kurz, dass man derzeit eine <strong>Stichprobentestung bei 2.000 Personen </strong>mache. Damit werde man Ende der Woche abschätzen können, wie viele Personen tatsächlich infiziert sind. Auch beim medizinischen Personal werden entsprechende Testungen durchgeführt.<br></p><p>Innenminister Karl Nehammer (ÖVP) kündigte ein <strong>konsequentes Vorgehen der Polizei gegen Missetäter und entsprechende Strafen</strong> an. Das Nichteinhalten des Mindestabstands nannte der Innenminister ""katastrophal gefährlich"". Wer nach polizeilicher Abmahnung sein Fehlverhalten nicht umgehend einstelle, ""wird konsequent angezeigt, wenn er den Anordnungen nicht Folge leistet"". Über 10.000 polizeiliche Anzeigen wegen Verstößen gegen das Anti-Corona-Maßnahmenpaket seien bisher bereits bundesweit ergangen. Allein am vergangenen Wochenende habe es mehr als 2.000 Anzeigen gegeben, so Nehammer.</p><h3>Maßnahmen bleiben wohl bis nach Ostern aufrecht</h3><p>Eine Rückkehr zum Alltagsleben zeichnet sich jedenfalls nicht ab, ganz im Gegenteil: ""Die Wahrheit ist: Es ist die Ruhe vor dem Sturm"", sagte Kurz. Bereits vor der Pressekonferenz am Montag war ein Papier öffentlich geworden, in dem Experten ""deutlich strengere Maßnahmen"" fordern, weil sonst das Gesundheitssystem Mitte April zusammenbrechen könnte. Kurz und Kogler bestätigten diese Befürchtung seitens der Regierung und erklärten, man müsse in Bezug auf die Strategieplanung nun von den pessimistischeren Prognosen ausgehen.</p><p>Insofern würden die gesetzten Maßnahmen wohl über Ostern hinweg aufrecht bleiben. Zwar gab es von der Regierung keinen konkreten Zeithorizont, Vizekanzler Werner Kogler (Grüne) stellte das aber unmissverständlich klar: Man lege mit den Maßnahmen jetzt nach – ""und es kann nicht nach Ostern lockerer werden"". Und: Es haben niemand etwas davon, wenn wir uns herstellen und sagen, nach Ostern geht es lustig weiter – dann gibt es viel mehr Tote, sagte der Vizekanzler. Bundeskanzler Sebastian Kurz machte zudem klar, dass zunächst der Handel, dann erst die Schulen und Universitäten aufgesperrt werden. (red, 30.3.2020)</p><p><strong>Schon gehört?</strong></p><p><strong><br></strong></p>DER STANDARD/APAAm Montag wurden neue Maßnahmen zur Eindämmung des Coronavirus vorgestellt. Die österreichische Regierung setzt auf Masken beim Einkauf, Tests und Freistellungen für Risikogruppen. Der Bericht zum Video auf: https://www.derstandard.at/story/2000116325081/DER STANDARDAm Montag wurden neue Maßnahmen zur Eindämmung des Coronavirus vorgestellt. Die österreichische Regierung setzt auf Masken beim Einkauf, Tests und Freistellungen für Risikogruppen. Der Bericht zum Video auf: https://www.derstandard.at/story/2000116325081/<iframe style=""border: none"" src=""//html5-player.libsyn.com/embed/episode/id/13761674/height/90/theme/custom/thumbnail/yes/direction/backward/render-playlist/no/custom-color/60bfd3/"" height=""90"" width=""100%"" scrolling=""no""  allowfullscreen webkitallowfullscreen mozallowfullscreen oallowfullscreen msallowfullscreen></iframe>Neuer HTML TagFoto: APA/HELMUT FOHRINGERFoto: APA/ROLAND SCHLAGER",-0.0018461691542288558,0.0003333333333333333
2000116346340,/jetzt/livebericht/2000116346340/schrittweise-einfuehrung-der-maskenpflicht-in-der-oeffentlichkeit,(keine Angabe),Coronavirus,Redaktion,Online only,LiveBericht,2020-03-31 05:34:39.260,"Maskenpflicht im Supermarkt spätestens ab Montag, Entscheidung über Matura nach Ostern","﻿2.0CoronavirusMaskenpflicht im Supermarkt spätestens ab Montag, Entscheidung über Matura nach OsternCoronavirus-Maskenpflicht-im-Supermarkt-spaetestens-ab-Montag-Entscheidung-ueber-Matura-nach-OsternDie Zahl der positiv auf das Coronavirus Getesteten ist in Österreich auf mehr als 10.000 gestiegen. In Salzburg werden Altenmarkt, Zell am See und Saalbach unter Quarantäne gestellt<p><strong>Das Wichtigste in Kürze:</strong></p><ul><li>Mit Stand Dienstag, 23 Uhr gab es in Österreich <a href=""https://info.gesundheitsministerium.at/"" target=""_blank"" rel=""nofollow"">laut Gesundheitsministerium</a> <strong>10.180 bestätigte Corona-Fälle</strong>. Nach Bundesländern: Tirol 2.358, Niederösterreich 1.636, Oberösterreich 1.635, Wien 1.417, Steiermark 1.063, Salzburg 949, Vorarlberg 659, Kärnten 278, Burgenland 185. Laut Innenministeriumszahlen sind <strong>128 Menschen an Covid-19 gestorben</strong> (Stand 10 Uhr), <strong>1.095 gelten als genesen.</strong></li><li>In <strong>Tirol</strong> haben sich in den letzten 24 Stunden mit 117 Genesenen und 57 Neuinfektionen <strong>erstmals mehr Menschen erholt als neu angesteckt, </strong>erklärte Landeshauptmann Günther Platter (ÖVP) am Dienstagnachmittag. Das zeige, dass man auf dem richtigen Weg sei. Hinweisen auf mögliche Fehler von Tiroler Behörden werde man nachgehen.</li><li><strong>Das Tragen von Mund-Nasen-Masken in Supermärkten</strong>, Drogerien und Drogeriemärkten wird <strong>spätestens ab Montag, 6. April zur Pflicht</strong>, heißt es in einem Erlass des Gesundheitsministeriums. Verteilt werden sollen die Masken schon ab Mittwoch, 1. April. </li><li>Die <strong>Quarantänegebiete in Salzburg werden ausgeweitet:</strong> Altenmarkt, Zell am See und Saalbach werden zusätzlich unter Quarantäne gestellt.</li><li>Eine <b>Entscheidung über den Maturatermin </b>soll es erst nach Ostern geben, sagte Bildungsminister Heinz Faßmann (ÖVP) am Dienstag.<b> Noch keinen Termin gibt es für ein Ende des Notbetriebs an den Schulen.</b> In den kommenden Wochen sollen zudem Schulpsychologen und Sozialarbeiter jene <b>Schüler per Telefon kontaktieren,</b> mit denen es seit 16. März keinen Kontakt mehr gebe. </li><li><strong>3.500 außerordentliche Zivildiener treten am Mittwoch ihren Dienst an. </strong>Sie werden bei der Versorgung und Betreuung älterer Menschen sowie bei Kranken- und Rettungstransporten helfen, um Personalengpässe zu verhindern.</li><li>Derzeit findet eine <strong>Stichprobentestung bei 2.000 Personen statt.</strong> Damit werde man Ende der Woche abschätzen können, wie viele Personen tatsächlich infiziert sind. Auch beim medizinischen Personal werden entsprechende Tests durchgeführt. </li><li>Die <strong>Medizinische Universität Innsbruck </strong>will am <strong>Tiroler Corona-Hotspot Ischgl </strong>sogenannte <strong>Antikörpertests</strong> durchführen. Damit sollen Rückschlüsse möglich werden, wie viele Infektionen ohne Symptome verlaufen. Zudem soll eruiert werden, ob in Ischgl bereits eine Art <strong>lokale Herdenimmunität</strong> entstanden ist. </li><li>Die wichtigste Corona-Regel lautet: <b>Bleiben Sie so weit wie möglich zu Hause,</b> schränken Sie Ihre Sozialkontakte ein. Einkaufen, um die Grundversorgung zu gewährleisten, ist gestattet, der Aufenthalt im öffentlichen Raum nur allein oder mit Personen aus einem gemeinsamen Haushalt. Halten Sie die Abstandsregel von mindestens einem Meter ein.<br><br></li></ul><h3><b>Weitere Informationen</b></h3><p>Die <b>Ages</b> beantwortet Fragen rund um das Coronavirus unter der Nummer <b>0800 555 621.</b> Sollten Sie <b>Symptome</b> aufweisen, rufen Sie bei der landesweit gültigen <b>Gesundheitshotline 1450</b> an.</p><p><a href=""/story/2000115667995/die-wichtigsten-fragen-und-antworten-zum-coronavirus"">Die wichtigsten Fragen und Antworten zum Coronavirus</a></p><p><a href=""/story/2000115810293/aktuelle-zahlen-zum-coronavirus"">Die aktuellen Zahlen zum Coronavirus</a></p><p><a href=""/story/2000115809846/podcast-coronavirus-lockdown-unser-neues-leben-in-der-isolation"">Podcast: Coronavirus-Lockdown – unser neues Leben in der Isolation</a></p><p><a href=""/story/2000115678028/richtiges-verhalten-in-heimischer-quarantaene"">Richtiges Verhalten in heimischer Quarantäne</a></p><p><a href=""https://www.ages.at/themen/krankheitserreger/coronavirus/"" target=""_blank"">Aktuelle Covid-19-Situation in Österreich (Ages)</a></p><p><a href=""https://www.sozialministerium.at/Informationen-zum-Coronavirus/Neuartiges-Coronavirus-(2019-nCov).html"" target=""_blank"">Bestätigte Fälle und Testungen in Österreich (Gesundheitsministerium)</a></p><p><a href=""https://www.integrationsfonds.at/newsbeitrag/covid-19-mehrsprachige-informationen-zu-wichtigen-hygiene-und-verhaltensregeln-5339"" target=""_blank"">Hinweise zur Situation und Verhaltensregeln in mehreren Fremdsprachen (Integrationsfonds)</a></p><p>(red, 31.3.2020)</p>Foto: APA/HELMUT FOHRINGERFoto: APA/EXPA/ STEFANIE OBERHAUSERFoto: APA/HERBERT P. OCZERETFoto: APA/BARBARA GINDLFoto: EPA/CHRISTIAN BRUNAFoto: AP/Ronald ZakFoto: apa/schlagerFoto: Georg Hochmuth/Pool via REUTERSFoto: APA/HERBERT PFARRHOFERAP Photo/Patrick SemanskyFoto: REUTERS/Leonhard FoegerFoto: EPAFoto: APA/EXPA/ JOHANN GRODERFoto: AP Photo/Bebeto Matthews",0.0004106469002695417,0.0
2000116371728,/jetzt/livebericht/2000116371728/mittwoch-um-14-uhr-im-chat-clemens-martin-auer-sonderbeauftragter,(keine Angabe),Coronavirus,Redaktion,Online only,LiveChat,2020-03-31 16:15:23.100,"Sonderbeauftragter Clemens Auer: ""Italienische oder spanische Verhältnisse vermeiden""","﻿2.0CoronavirusSonderbeauftragter Clemens Auer: ""Italienische oder spanische Verhältnisse vermeiden""Coronavirus-Sonderbeauftragter-Clemens-Auer-Italienische-oder-spanische-Verhaeltnisse-vermeidenMaskenpflicht und mehr Testungen gegen die Coronavirus-Verbreitung? Clemens Auer aus dem Gesundheitsministerium war im Chat zu Gast<p>Seit Mittwoch werden in Österreichs Supermärkten Gesichtsmasken verteilt. Eine Maßnahme, die Clemens Martin Auer, Sonderbeauftragter im Gesundheitsministerium und in dieser Rolle Berater von Gesundheitsminister Rudolf Anschober (Grüne), begrüßt: ""Sinn und Zweck der Übung ist ja, dass die Personen den potenziellen Ausstoß von Tröpfchen aus dem Mund- und Nasenbereich minimieren, sodass diese Tröpfchen nicht auf die andere Person gelangen"", beantwortet er eine entsprechende Frage eines Users.</p><p>Auer wurde am Mittwoch im STANDARD-Chat auch mit Kritik konfrontiert, etwa mit der Frage, warum so wenig getestet werde: ""Wir haben in Österreich mit dem heutigen Tag über 80.000 Tests durchgeführt, wobei wir auch im internationalen Vergleich im oberen Drittel aller Länder liegen."" Man teste derzeit Personen mit Symptomen und habe begonnen, auch repräsentative Testungen in der Bevölkerung und einzelnen Berufsgruppen vorzunehmen. ""Die Tests sind zwar nicht billig, aber jeder eingesetzte Euro ist gut investiert, um Klarheit über die Entwicklung der Pandemie zu bekommen"", so Auer. Dass die Coronavirus-Pandemie anfangs nicht ernst genug genommen wurde, weist der Experte zurück: ""Ich habe es in meiner langen beruflichen Karriere noch nie erlebt, dass die zuständigen Gesundheitsbehörden in den allermeisten Ländern so rasch auf ein neu aufgetretenes Virus reagiert haben.""</p><p>Auch das Maßnahmenpaket der Regierung verteidigt Auer. Es sei nicht das Ziel, die Schulen und Unternehmen über Monate hinweg geschlossen zu halten. ""Aber wir müssen die Neuinfektionsrate zu Beginn der Pandemie flach halten damit es in den stationären Einrichtungen für die besonders stark Erkrankten nicht zu ähnlichen dramatischen Verhältnissen wie in Italien oder Spanien kommt.""</p><h3>Keine ""diktatorischen Mittel""</h3><p>Die Entscheidungsfindung in den Krisenstäben erfolge ""mit einem hohen ethischen Bewusstsein in der Abwägung, was richtig und falsch ist"", so Auer. Man habe es geschafft, Maßnahmen zu setzen, ohne zu ""diktatorischen Mitteln"" greifen zu müssen.</p><p>Die Zusammenarbeit mit den Bundesländern bezeichnet er als gelungen: ""Ich meine, dass sich die Verantwortlichen gemeinsam mit uns vorbildlich auf alle Eventualitäten vorbereiten.""</p><p>In Sachen Entwicklung eines Impfstoffes glaubt Auer, Geduld an den Tag legen zu müssen. Die Weltgesundheitsorganisation (WHO) gehe davon aus, dass ein solcher Impfstoff realistischerweise nicht vor einem Jahr zur Verfügung stehen werde. Anders verhalte es sich mit Medikamenten: ""Solche Therapien werden vor Impfstoffen vorliegen.""</p><p>Schließlich gibt Auer noch Entwarnung, was die Übertragung des Virus über Papier oder Kartonagen bzw. Essenszusteller betrifft: ""Es ist in der Literatur unbekannt, dass sich der Virus auch über Kartonagen weiterverbreitet. Sie können daher unbedenklich Ihren Pizzakarton angreifen. Wenn Sie aber sicher sein wollen, dann waschen Sie sich gründlich die Hände."" (Rosa Winkler-Hermaden, 1.4.2020)</p>Foto: STANDARD/HendrichFoto: STANDARD/Corn",-0.0018261036468330133,-0.04786363636363636
