ID_GodotObject,url,author,RessortName,source,sourceCategory,ObjectType,publishingDate,titletext,content,sentiment_content,sentiment_titletext
2000118890822,/jetzt/livebericht/2000118890822/regierung-kuendigt-wiedereinfuehrung-der-maskenpflicht-in-supermaerkten-banken-und-postfilialen,(keine Angabe),Coronavirus,Redaktion,Online only,LiveBericht,2020-07-21 14:38:23.700,Regierung kündigt Maskenpflicht und verstärkte Quarantäne- und Grenzkontrollen an,"﻿2.0Ab FreitagRegierung kündigt Maskenpflicht und verstärkte Quarantäne- und Grenzkontrollen anAb-Freitag-Regierung-kuendigt-Maskenpflicht-und-verstaerkte-Quarantaene--und-Grenzkontrollen-anDie Pflicht zum Tragen des Mund-Nasen-Schutzes wird ab Freitag wieder ausgeweitet. Eine Einreise aus Risikogebieten wird nur noch mit negativem PCR-Test erlaubt sein<h3>Das Wichtigste in Kürze:</h3><ul><li>Wegen der gestiegenen Covid-19-Infektionszahlen verschärft die Regierung wieder die Maßnahmen: Ab Freitag gilt in <strong>Supermärkten, Banken und der Post</strong> erneut die <a href=""/story/2000118893116/die-maskenpflicht-kehrt-in-supermarkt-banken-und-postfilialen-zurueck"">Pflicht zum Tragen eines Mund-Nasen-Schutzes</a>, gab Bundeskanzler Sebastian Kurz (ÖVP) in einer Pressekonferenz bekannt.</li><li>Strenger gehandhabt werden auch die Regeln an Österreichs Grenzen. Ebenfalls ab Freitag ist die <strong>Einreise aus Risikogebieten nur noch mit negativem PCR-Test</strong> erlaubt. Dieser muss aus zertifizierten Laboren stammen. Es kommt eine <strong>verstärkte Quarantäneüberwachung</strong>, und Grenzkontrollen werden verschärft.</li><li>Gesundheitsminister Rudolf Anschober (Grüne) kündigte an, dass die Leitlinien zur Corona-Ampel im August beschlossen werden sollen. <strong>Ein Probelauf soll im August stattfinden.</strong> <br></li><li><a href=""/story/2000118888558/wiener-linien-bestraften-bisher-90-masken-suender"">Die </a><a><b>Wiener Linien</b> bestraften bisher 90 ""Maskensünder"", die <b>ÖBB</b> straften bisher ""ein gutes Dutzend"".</a></li><li>Eine 35-Jährige muss am Freitag in Ried im Innkreis vor <b>Gericht,</b> weil sie trotz Corona-Erkrankung und verordneter Heimquarantäne spazieren gegangen sein soll.<br></li><li>In <b>Brasilien</b> wurden zwei weitere Minister positiv auf das Coronavirus getestet, mehr als <b>80.000 Menschen</b> sind im Zusammenhang mit der Lungenkrankheit Covid-19 gestorben.<br></li><li>Angesichts dramatisch steigender Infektionszahlen will <b>US-Präsident Donald Trump</b> nach knapp drei Monaten seine Coronavirus-<b>Pressekonferenzen</b> wiederaufnehmen.</li><li>Die <b>Weltgesundheitsorganisation</b> hat die Studienergebnisse zu einem <b>britischen Impfstoff </b>gegen das Coronavirus als ""gute Nachricht"" begrüßt. <a href=""/story/2000118874325/studie-bestaetigt-wirkung-von-corona-impfstoff-der-uni-oxford"">Die Tatsache, dass das Vakzin erfolgreich getestet worden sei und keine ernsthaften Nebenwirkungen in den Probanden hervorgerufen habe</a>, sei ""ein positives Ergebnis"". Nun müssten weitere Studien in größerem Umfang folgen. (red, 21.7.2020)</li></ul>Foto: Robert NewaldFoto: APA/ROLAND SCHLAGERFoto: REUTERS/Lisi NiesnerFoto: REUTERS/LEONHARD FOEGERFoto: APA / Helmut Fohringer",-0.004312082262210797,-0.054966666666666664
2000118904988,/2000118904988/Stimmen-aus-dem-Forum-Ausweitung-der-Maskenpflicht,(keine Angabe),Coronavirus,UGC,UGC,Artikel,2020-07-23 09:00:00.000,Stimmen aus dem Forum: Ausweitung der Maskenpflicht,"﻿2.0MitredenStimmen aus dem Forum: Ausweitung der MaskenpflichtMitreden-Stimmen-aus-dem-Forum-Ausweitung-der-MaskenpflichtIst die Rückkehr der Maske in die Bereiche des täglichen Lebens übertrieben oder gerechtfertigt? Teilen Sie Ihre Meinung im Forum!Wie stehen Sie zu den neuen Maskenregelungen?<p>Die Maske kehrt zurück. <a href=""/story/2000118893116/die-maskenpflicht-kehrt-in-supermarkt-banken-und-postfilialen-zurueck"">Ab Freitag muss der Mund-Nasen-Schutz nun auch wieder im Supermarkt, in Bank- und Postfilialen angelegt werden.</a> Der zunehmenden Sorglosigkeit solle somit Einhalt geboten werden und das Risikobewusstsein der Bevölkerung wieder gestärkt. In den Bereichen des täglichen Lebens, die von allen frequentiert werden müssen, solle so der Schutz von Risikogruppen gewährleistet werden.</p><h3>Stimmen aus dem Forum</h3><p>Im STANDARD-Forum ruft diese – schon seit mehreren Tagen erwartete – Nachricht sehr geteilte Meinungen hervor. ""Übertrieben"" findet dieser User die neue Regelung:</p><p>Nicht ganz logisch findet dieser User die Bestimmung:</p><p>Einige empfinden die Maske als Zwang, dieser User sieht gar seine Lebensfreude gefährdet:</p><p>Corona stelle im Moment keine Gefahr mehr dar, währenddessen werde die Wirtschaft gegen die Wand gefahren, meint dieser User:</p><p>Doch längst nicht alle sind gegen die neue Verordnung, viele äußern Verständnis für die Entscheidung:</p><p>Das Tragen einer Maske sei im Vergleich zu den Alternativen noch das geringste Übel:</p><p>Dieser User ist der Meinung, dass eine gewisse Disziplinierung der Bevölkerung notwendig sei:</p><p>Eine zunehmende Sorglosigkeit im Umgang mit der Maske konnte dieser User in seinem Österreichurlaub beobachten, er findet die ab Freitag geltenden Regeln daher gut:</p><h3>Wie sehen Sie das?</h3><p>Finden Sie die neue Regelung gut? Geht sie Ihnen zu weit oder nicht weit genug? Wie ist das in Ihrem sozialen Umfeld, welche Beobachtungen konnten Sie in Ihrem Alltag machen? Ist es genug, sich auf die Eigenverantwortung der Bevölkerung zu verlassen? Teilen Sie Ihre Meinung und Erfahrungswerte im Forum! (aan, 23.7.2020)</p><p><strong>Zum Thema</strong></p><p><a href=""/story/2000118893116/die-maskenpflicht-kehrt-in-supermarkt-banken-und-postfilialen-zurueck"">Die Maskenpflicht kehrt in Supermarkt, Banken und Postfilialen zurück</a></p><p><a href=""/story/2000118920791/videoumfrage-zur-erneuten-maskenpflicht-ich-hatte-sie-nie-abgenommen"">Videoumfrage zur erneuten Maskenpflicht: ""Ich hatte sie nie abgenommen""</a></p>Foto: APA/HELMUT FOHRINGER1056848355von beobachtungen her gute entscheidung1056851530sinnvolle maßnahme1056840493disziplinierung gute sache1056843922alibihandlung1056852938übertrieben1056839120wirtschaft gegen wand fahren1056851673welche freiheit wird beschränkt?1056853079maske geringstes übel1056851074zwang mag keine masken1056839150kein grund zur sorge1056859929verständnis für tragen der maske1056857109virus ohne maske vergessen1056839037erklärt es1056839430versteht regelung nicht schwachsinn1056848201froh darüber supermarkt",-0.004125897435897436,0.0
2000119010979,/jetzt/livebericht/2000119010979/corona-cluster-in-st-wolfgang-waechst-auf-62-infizierte,(keine Angabe),Coronavirus,Redaktion,Online only,LiveBericht,2020-07-28 07:26:51.810,Corona-Cluster in St. Wolfgang wächst auf 62 Infizierte – Missachtung der Abstandsregeln bald bundesweit nicht mehr gestraft,"﻿2.0Tagesüberblick CoronaCorona-Cluster in St. Wolfgang wächst auf 62 Infizierte – Missachtung der Abstandsregeln bald bundesweit nicht mehr gestraftTagesueberblick-Corona-Corona-Cluster-in-St-Wolfgang-waechst-auf-62-Infizierte--Missachtung-der-Abstandsregeln-bald-bundesweit-nicht-mehr-gestraftGesundheitsminister Anschober will das Ministerium reformieren. Ein neues Epidemiegesetz für Österreich soll 2021 kommen. Das Wichtigste des Tages im Überblick<p><b>Das Wichtigste in Kürze:</b></p><ul><li>Nachdem der Verfassungsgerichtshof (VfGH) mehrere Bestimmungen zur Coronavirus-Bekämpfung für gesetzeswidrig erklärt hatte, kündigte <strong>Gesundheitsminister Rudolf Anschober (Grüne) bei einer Pressekonferenz am Dienstag eine umfassende Reform des Gesundheitsministeriums an.</strong> Prozesse bei der Erstellung von Rechtsmitteln sollen neu aufgestellt werden. Im juristischen Bereich soll das Personal deutlich aufgestockt werden. In den nächsten Tagen sollen die <strong>Abstandsregeln der Verordnung außer Kraft gesetzt werden. Das heißt, es wird dann österreichweit nicht mehr gestraft.</strong></li><li>Anschober kündigte auch ein <strong>neues Epidemiegesetz für 2021</strong> an. <br></li><li>Die <a href=""/story/2000119006698/st-wolfgang-nimmt-den-cluster-gelassen"">Zahl der Infizierten im Salzkammergut-Tourismusort <b>St. Wolfgang</b></a> ist bis zum späten Montagabend<b> auf 62 angestiegen.</b> Das teilte der Krisenstab des Landes Oberösterreich mit. Nur bei 38 von insgesamt 1.183 durchgeführten Tests waren die Ergebnisse noch ausständig. </li><li>Das <strong>Land Salzburg testet ab Dienstag alle Tourismuspraktikanten</strong> in den zwei Salzburger Anrainergemeinden St. Gilgen und Strobl <strong>am Wolfgangsee.</strong></li><li>Die Corona-Krise hat den <strong>Arbeitsmarkt</strong> weiter fest im Griff. Nach wie vor sind <strong>432.000 Menschen arbeitslos,</strong> wobei die Zahl zuletzt leicht gesunken ist. <strong>474.600 Personen </strong>befinden sich in <strong>Kurzarbeit. </strong></li><li>Die <a href=""/story/2000119004638/gruene-zu-koestingers-corona-strategie-pr-aktionen-die-nicht-funktionieren"">grüne Tourismussprecherin Barbara Neßler fordert</a>, dass die Rolle von <b>McKinsey beim Testungsprojekt ""Safe A"" offengelegt</b> wird.</li><li>Das Coronavirus sorgt dafür, dass sich die Länder um <a href=""/story/2000118984808/kindergaerten-bleiben-im-sommer-oefter-offen""><b>mehr offene Kindergärten im Sommer</b> </a>bemühen. Bund und Länder investieren Millionen, um Eltern zu entlasten.</li><li>Die <b><a href=""/story/2000119010693/lehrer-gewerkschaft-will-maskenpflicht-fuer-alle-im-naechsten-schuljahr"">Lehrergewerkschaft fordert eine Maskenpflicht</a> für alle im nächsten Schuljahr.</b> Eine solche Regelung war am 3. Juni ausgelaufen. Während die <strong>SPÖ</strong> den ""Masterplan"" der Gewerkschaft in einer Aussendung begrüßt, sprechen sich die <strong>Neos</strong> klar gegen eine allgemeine Maskenpflicht in Schulen aus. <br></li><li>Nach einem starken Anstieg der Infektionszahlen <a href=""/story/2000119010589/belgien-verschaerft-corona-massnahmen-deutlich""><b>verschärft Belgien seine Corona-Schutzmaßnahmen</b></a>. Private Treffen werden etwa stark eingeschränkt. (red, 28.7.2020)</li></ul>Foto: APAFoto: APA",-0.002285995623632385,-0.00028235294117647056
2000119396183,/jetzt/livebericht/2000119396183/reisewarnung-fuer-kroatien-in-kraft-fassmann-praesentiert-plaene-fuer-schulbeginn,(keine Angabe),Coronavirus,Redaktion,Online only,LiveBericht,2020-08-17 05:59:41.980,"Kroatischer Botschafter hofft auf nur partielle Reisewarnung, Schulstart ohne halbe Klassen und Schichtbetrieb","﻿2.0CoronavirusKroatischer Botschafter hofft auf nur partielle Reisewarnung, Schulstart ohne halbe Klassen und SchichtbetriebCoronavirus-Kroatischer-Botschafter-hofft-auf-nur-partielle-Reisewarnung-Schulstart-ohne-halbe-Klassen-und-SchichtbetriebDiplomat sagt zur APA, die Schnelligkeit der Wiener Entscheidung habe ""alle schockiert"". Laut Bildungsminister Faßmann soll künftig viel Schulunterricht im Freien stattfinden<h3>Das Wichtigste in Kürze:</h3><ul><li>Um Mitternacht ist eine <a href=""/story/2000119377102/was-ab-montag-fuer-kroatien-urlauber-gilt""><b>Reisewarnung für Kroatien</b></a> in Kraft getreten. Einreisende aus Kroatien müssen einen negativen PCR-Test vorlegen oder sich binnen 48 Stunden in Österreich testen lassen. Grenzkontrollen wurden bereits verstärkt. Lange Wartezeiten waren die Folge.</li><li>Der <strong>Botschafter </strong>des Landes in Österreich, Daniel Gluncic, zeigte sich in der APA über die <strong>Geschwindigkeit der Entscheidung irritiert</strong>. Er hofft auf eine Rücknahme der pauschalen Warnung und schlägt stattdessen regionale Einschätzungen vor.</li><li><b>Gesundheitsminister Rudolf Anschober</b> (Grüne) ist trotz der Reisewarnung <b>gegen eine Testung an den Grenzen.</b> Für jene, die in den letzten Tagen aus Kroatien zurückgekehrt sind, gelte zwar keine verpflichtende Quarantäne, Anschober bittet sie aber um Vorsicht.<br></li><li><a href=""/story/2000119395081/fassmann-stichprobenartige-tests-nach-schulstart-maskenpflicht-im-eingangsbereich-ab-ampelfarbe"">Bildungsminister Heinz Faßmann (ÖVP) kündigte in der ""ZiB </a><a href=""/story/2000119395081/fassmann-stichprobenartige-tests-nach-schulstart-maskenpflicht-im-eingangsbereich-ab-ampelfarbe"">2</a><a>""</a> erste <b>Eckpunkte zur Schulöffnung</b> im Herbst an. So soll es <b>keine flächendeckenden Schulschließungen</b> oder <b>Maskenpflicht im Unterricht</b> geben. Der Mund-Nasen-Schutz soll erst ab der Ampelfarbe Gelb im Eingangsbereich getragen werden. Bei der Pressekonferenz am Montag fügte er hinzu, dass <b>häufig gelüftet,</b> viel <b>Unterricht im Freien</b> stattfinden und eine <b>Durchmischung von Klassen vermieden </b>werden soll.</li><li>Ein erneutes Umstellen auf Heimunterricht bei regionaler Zunahme an Covid-19-Erkranungen an Österreichs Schulen wird es erst <strong>ab der Corona-Ampelfarbe Rot</strong> geben. Für Schüler der Sekundarstufe II, also ab rund 14 Jahren, kann Distance-Learning <strong>schon früher</strong> wieder Realität werden. Man brauche allerdings noch die ""<strong>klare Definition</strong>, ab wann die Ampelfarben springen"", sagte Faßmann: ""Unsere Ambition ist, uns der Ampelfarbe anzupassen."" <br></li><li>Der <strong>deutsche Gesundheitsminister Jens Spahn</strong> (CDU) warnt vor einem Zusammenhang zwischen den erneut steigenden Corona-Zahlen in Deutschland und Feierlichkeiten. Er wolle mit den Bundesländern <strong>Grenzen für Veranstaltungsgrößen</strong> prüfen.</li><li><strong>Neuseeland</strong> verschiebt die für 19. September geplanten <strong>Parlamentswahlen</strong> um vier Wochen. Grund sind Corona-Neuinfektionen, die Anfang der vergangenen Woche registriert wurden nach über 100 Tagen ohne neue Fälle. </li><li>Weil sich immer mehr Jugendliche mit dem Coronavirus infizieren, hat <strong>Italien</strong> die <strong>Schließung von Diskotheken und Stranddiskos</strong> beschlossen. Die Maßnahme gilt von heute, Montag, bis zum 7. September. (red, 17.8.2020)<br></li></ul>Foto:  APA / Helmut FohringerFoto: APA / EXPA / Johann Groder",-0.0010299424184261035,0.016557142857142857
2000119783957,/jetzt/livebericht/2000119783957/startschuss-fuer-corona-ampel-gelbes-licht-fuerwien-graz-linz-und,(keine Angabe),Coronavirus,Redaktion,Online only,LiveTicker,2020-09-04 06:53:23.100,"Nachlese Livebericht: ""Gelbes"" Linz will keine Verschärfungen durchführen","﻿2.0CoronavirusNachlese Livebericht: ""Gelbes"" Linz will keine Verschärfungen durchführenCoronavirus-Nachlese-Livebericht-Gelbes-Linz-will-keine-Verschaerfungen-durchfuehrenBei Gelb gibt es eine Verschärfung der Maskenpflicht im Handel, in der Gastronomie sowie bei Veranstaltungen. Alle Informationen werden über ""https://corona-ampel.gv.at/"" veröffentlicht<p>Wien – Mit dem Start der Corona-Ampel am Freitag sind bereits vier Regionen in Österreich auf Gelb geschaltet. Betroffen von Gelb – das bedeutet mittleres Risiko – sind der <strong>Bezirk Kufstein</strong> sowie die Städte <strong>Wien</strong>, <strong>Linz </strong>und <strong>Graz</strong>. Alle anderen Bezirke blieben auf Grün. Das System operiert mit den Farben Grün (niedriges Risiko), Gelb (mittleres), Orange (hohes) und Rot (sehr hohes Risiko).</p><p>Das sei ein guter Überblick für die Bevölkerung über die regionale Entwicklung, sagte Bundeskanzler Sebastian Kurz (ÖVP). Bei Gelb – so wie es jetzt in vier Regionen der Fall ist – gebe es eine Verschärfung der Maskenpflicht im Handel, in der Gastronomie sowie bei Veranstaltungen, sagte Kurz.</p><h3>Verschärfungen ab kommendem Freitag</h3><p>So muss künftig  in Kundenbereichen von allen geschlossenen Betriebsstätten eine Maske getragen werden. Das betrifft den Lebensmitteleinzelhandel, aber auch alle anderen Handelsgeschäfte, Post und Banken. Einschränkung: Sofern keine sonstigen geeigneten Schutzvorrichtungen zur räumlichen Trennung vorhanden sind. Diese Verschärfungen sollen ab kommenden Freitag gelten.</p><p>In der Gastronomie muss in ""gelben"" Bezirken künftig wieder Servicepersonal mit Kundenkontakt Maske tragen – außer es gibt auch andere Schutzvorrichtungen. Kunden sind nicht von dieser Verschärfung betroffen. Auch diese Novelle der Lockerungsverordnung soll kommende Woche vom Gesundheitsministerium erlassen werden und ab 11. September gelten.</p><p>Bei Orange und Rot seien die Maßnahmen von ausgeprägterer Form, Lockdowns seien aber nicht vorgesehen. Alle Informationen werden über <a href=""https://corona-ampel.gv.at/"" target=""_blank"">https://corona-ampel.gv.at/</a> veröffentlicht.</p><h3>Ärger in den Bundesländern</h3><p>Kurz nach der Pressekonferenz der Regierung reagierte der Linzer Bürgermeister Klaus Luger (SPÖ) öffentlich und merklich verstimmt, nachdem seine Stadt auf ""Gelb"" geschaltet wurde. ""Wir werden aufgrund dieses obskuren Ampelkonstrukts keine wie immer gearteten Verschärfungen durchführen"", kündigte er an. Für ihn ist die ""Farbgebung absolut nicht nachvollziehbar und steht in keiner Relation zur Realität in der Stadt"". ""Wir waren einigermaßen überrascht, um nicht zu sagen entsetzt"", sagte Luger. Er sieht ein ""sehr willkürliches Instrument"" und einen ""veritablen Fehlstart"" der Ampel, salopp gesagt einen ""Murks"".</p><p>Bereits bei der Sitzung der Corona-Kommission gestern brodelte es massiv zwischen Bund und Ländern, die alle in der Kommission vertreten sind. Es gab verschiedene Kritikpunkte, je nach Bundesland. Eines der Hauptprobleme aus Sicht der Länder: Die Ampel sei nicht fertig, weil relevante beanstandete Punkte nicht eingearbeitet worden seien. Sie sei deshalb noch nicht treffsicher. Laut STANDARD-Informationen soll Gesundheitsminister Rudolf Anschober (Grüne) von mehreren sehr verärgerten Landeshauptleuten angerufen worden sein.</p><p>Zumindest Steiermarks Landeshauptmann Hermann Schützenhöfer (ÖVP) gab sich gefasst: ""Die drei größten Städte in Österreich sind gelb. Das ist in Ballungszentren und aufgrund der steigenden Infektionszahlen nicht überraschend"". Man höre wie bisher auf die Meinung der Experten und werde alle Maßnahmen umsetzen. Der Grazer Gesundheitsstadtrat Robert Krotzer (KPÖ) wünscht sich jedoch mehr Unterstützung des Bundes für die überlasteten Gesundheitsbehörden: ""Das Contact Tracing bindet seit Monaten enorme Ressourcen. Alle arbeiten am Limit."" (red, APA, 4.9.2020)</p>Foto: APA/HANS PUNZFoto: ScreenshotFoto: KrutzlerFoto: APA/dpa/Felix KästleFoto: APA/dpa/Oliver Berg",-0.004208874801901744,0.0
2000119798370,/2000119798370/Corona-Ampel-Linz-will-Gelb-ignorieren-Verfassungsdienst-verweist-auf-Umsetzungspflicht,(keine Angabe),Coronavirus,Redaktion,Online only,Artikel,2020-09-04 16:23:07.000,"Corona-Ampel: Linz will Gelb ignorieren, Verfassungsdienst verweist auf Umsetzungspflicht","﻿2.0ReaktionenCorona-Ampel: Linz will Gelb ignorieren, Verfassungsdienst verweist auf UmsetzungspflichtReaktionen-Corona-Ampel-Linz-will-Gelb-ignorieren-Verfassungsdienst-verweist-auf-UmsetzungspflichtGesundheitsminister Rudolf Anschober hielt angesichts der Zweifel in Oberösterreich fest, dass er sehr wohl auch eine regionale Maskenpflicht aussprechen kann<p>Mit Wien, Linz und Graz und dem Bezirk Kufstein in Tirol sind vier Regionen bei der Premiere der Corona-Ampel von Grün auf Gelb gesprungen: Verschärfung der Maskenpflicht im Handel, in der Gastronomie, bei Veranstaltungen und in Schulen sind die Folgen einer Einstufung in der Kategorie ""mittleres Risiko"", gab Bundeskanzler Sebastian Kurz (ÖVP) am Freitag bei der Pressekonferenz der Regierung in Wien bekannt.</p><p>Vizekanzler Werner Kogler (Grüne) verstand die erste Ampelschaltung auch als Appell an die Bundesländer, bei der Geschwindigkeit der Corona-Testungen und bei der Kontaktverfolgung einen Zahn zuzulegen – und daher: ""Gemmas an!""</p><h3>Verfassungsdienst schaltet sich ein</h3><p>Um 10.15 Uhr gingen alle Informationen zur Ampel dann auch auf der neuen Webseite <a href=""https://corona-ampel.gv.at/"" target=""_blank"">https://corona-ampel.gv.at/</a> online, und nur 45 Minuten später gab es die erste Reaktion einer betroffenen Region: Der Linzer Bürgermeister Klaus Luger (SPÖ) gab bei einer Pressekonferenz bekannt, die Gelbschaltung ""seiner"" Stadt zu ignorieren und ""keine wie immer gearteten Verschärfungen"" durchzuführen. Man sei ""einigermaßen überrascht, um nicht zu sagen entsetzt"" über diese Einstufung. Landeshauptmann Thomas Stelzer (ÖVP) kündigte an, keine Empfehlung des Landes für Verschärfungen in Linz geben zu wollen.</p><p>Gesundheitsminister Rudolf Anschober (Grüne) hielt angesichts der Zweifel des oberösterreichischen Landeshauptmanns Thomas Stelzer (ÖVP) in einem Statement am Freitag fest, dass er sehr wohl auch eine regionale Maskenpflicht – etwa für die Stadt Linz – aussprechen könne. Angesichts der Diskussionen bezüglich der Umsetzung der Maßnahmen, die sich aus der Corona-Ampel ergeben, hat der Verfassungsdienst Freitagnachmittag klargestellt, dass Verordnungen auch seitens der Gemeinden und Länder einzuhalten sind.</p><h3>Wien und Graz: Gelb erwartbar</h3><p>Aber Luger war nicht der Einzige, der am Freitag Transparenz einforderte. Auch laut dem Wiener Bürgermeister Michael Ludwig (SPÖ) sei es nach wie vor nicht ganz klar, wie die Veränderungen der Ampel zustande kommen und welche konkreten Auswirkungen sie nach sich ziehen.  Gleichzeitig gestand Ludwig zu, dass eine gelbe Ampelschaltung für Wien erwartbar gewesen sei.</p><p>In Graz und Kufstein herrschte indessen Gelassenheit: Der Grazer Bürgermeister Siegfried Nagl (ÖVP) zeigte sich am Freitag über Gelb für seine Stadt ""kaum verwundert"". Es sei ""nicht überraschend"", dass gerade Ballungszentren wie Wien und Graz von der Corona-Ampel des Bundes betroffen sind. ""Die Situation ist ernst zu nehmen, und unser übergeordnetes Ziel ist es, rasch und dauerhaft den grünen Ampelstatus zu erreichen"", sagte Nagl in einer Stellungnahme. Der steirische Landeshauptmann Hermann Schützenhöfer (ÖVP) sagte zur auf Gelb geschalteten Corona-Ampel, dass dies für Ballungszentren ""nicht überraschend und auch kein Grund für übertriebene Aufregung"" sei.</p><p>In Tirol nahm man die gelbe Corona-Ampel im Bezirk Kufstein zurückhaltend entgegen: Landeshauptmann Günther Platter (ÖVP) kündigte im Rahmen einer Pressekonferenz an, wie in Wien erst einmal die bundesweite Verordnung abwarten zu wollen.</p><h3>Gemischte Reaktionen</h3><p>Bei der Opposition stößt die Corona-Ampel auf wenig Verständnis. Die SPÖ warnte vor einem ""Ampelchaos"" wegen der ausständigen gesetzlichen Grundlage. Die FPÖ sah die Wirtschaft an die Wand fahren. Lediglich bei den Neos war das Echo positiv, sahen sie doch einen Schritt zu mehr Klarheit für die Bevölkerung.</p><p>Gemischte Reaktionen gab es vonseiten der Gastronomie- und Kulturvertreter. Der Gastrospartenobmann der Wirtschaftskammer, Mario Pulker, sieht die Maskenpflicht für das Servicepersonal bei Stufe Gelb der Corona-Ampel nicht als Problem. Man habe im Frühjahr damit schon Erfahrung gemacht, und einige Gastrobetriebe hätten weiterhin bei Mitarbeitern auf Mund-Nasen-Schutz gesetzt. Pulker vermisst allerdings Details zu Quarantänebestimmungen, falls es zu einem Corona-Fall unter den Beschäftigten kommen sollte.</p><p>Dass die Corona-Ampel in der Bundeshauptstadt auf Gelb stehen wird, bedeutet jedenfalls abermals Einschränkungen für Veranstaltungen in Innenräumen. APA-Informationen zufolge dürften es in den nächsten Tagen wieder zu ersten Absagen bei großen Events der Messe- und Kongressbranche kommen. Die seit Freitag – vorerst nur auf Empfehlungsbasis – leuchtende Corona-Ampel beschäftigt zudem auch die heimische Fußball-Bundesliga.</p><p>Kulturstaatssekretärin Andrea Mayer (Grüne) verteidigte das Ampelsystem: Es sein ein sinnvolles Arbeitsinstrument.  Ihr sei wichtig gewesen, dass auch bei Ampelfarbe Gelb große Veranstaltungen stattfinden können und den Künstlerinnen und Künstlern Auftrittsmöglichkeiten geboten werden, was der Fall sei: ""Der Unterschied zwischen den Ampelfarben Grün und Gelb ist nicht so groß."" Eine zentrale Differenz sei, dass der Mund-Nasen-Schutz bei Gelb auch während der Vorstellung getragen werden müsse. Erst bei Orange würde die Kulturbranche erheblich leiden. (APA, 4.9.2020)<br></p><p>Die Regierung präsentierte am Freitag Details zur Corona-Ampel.</p>Foto: APA/Punz",-0.0029381235154394294,0.0
