ID_GodotObject,url,author,RessortName,source,sourceCategory,ObjectType,publishingDate,titletext,content,sentiment_content,sentiment_titletext
2000122442386,/2000122442386/Treffen-mit-sechs-Personen-zu-Silvester-Test-Pflicht-fuer-bestimmte,(keine Angabe),Coronavirus,AutorIn,Online only,Artikel,2020-12-12 07:13:09.000,"Wie viele Menschen kann man nun zu Weihnachten, zu Silvester oder an Werktagen treffen?","﻿2.0Fragen und AntwortenWie viele Menschen kann man nun zu Weihnachten, zu Silvester oder an Werktagen treffen?Fragen-und-Antworten-Wie-viele-Menschen-kann-man-nun-zu-Weihnachten-zu-Silvester-oder-an-Werktagen-treffenDie wichtigsten Fragen und Antworten zu den Corona-Maßnahmen für die Feiertage<p>Freitagnacht verkündeten Bundeskanzler Sebastian Kurz (ÖVP) und Vizekanzler Werner Kogler (Grüne) die Corona-Maßnahmen für die Feiertage. Und sie präsentierten die Pläne für die Massentests Anfang des kommenden Jahres. ""Gerade im privaten Bereich ist die Ansteckung hoch"", betonte Kurz nach einem Treffen mit den Landeshauptleuten. Und: ""Das Virus macht vor den Feiertagen keinen Halt."" Das Ansteckungsniveau sei nach wie vor zu hoch. Im Jänner, Februar und März würden noch ""harte Zeiten"" auf die Österreicher zukommen.</p><p><strong>Frage: Welche Regelungen gelten aktuell? Wen darf ich derzeit treffen? </strong></p><p><strong>Antwort: </strong>Derzeit gelten, wie schon vor dem harten Lockdown, der am 6. Dezember ausgelaufen ist, Kontaktbeschränkungen und Ausgangssperren in der Nacht. Von 20 Uhr abends bis 6 Uhr früh darf man die eigenen vier Wände nur mit aus diesen Gründen verlassen: Arbeit, Bedürfnisse des täglichen Lebens, Hilfe für andere Menschen und Bewegung an der frischen Luft. Tagsüber dürfen sich hingegen maximal sechs Erwachsene plus sechs Kinder aus zwei unterschiedlichen Haushalten treffen.</p><p><strong>Frage: Welche Regelungen gelten für Weihnachten? </strong></p><p><strong>Antwort:</strong> An den Weihnachtsfeiertagen sollen die Kontakt- und Ausgangsbeschränkungen gelockert werden, damit Familien diese Tage gemeinsam verbringen können. Am 24. und am 25. Dezember dürfen sich daher bis zu zehn Personen aus beliebig vielen Haushalten treffen und gemeinsam Geschenke auspacken – auch nach 20 Uhr.</p><p><strong>Frage: Gelten die Lockerungen für die ganzen Weihnachtsfeiertage?</strong></p><p>Antwort: Ursprünglich war das angedacht. Wegen des weiterhin hohen Infektionsgeschehens entschied die Bundesregierung jedoch die Ausnahmen auf den 24. und 25. Dezember zu beschränken. Am Stefanitag, den 26. Dezember, gelten wieder die gewohnten Beschränkungen: Aus zwei Haushalten dürfen sich maximal sechs Erwachsene plus sechs Kinder bis 20 Uhr treffen.</p><p><strong>Frage: Wie kann ich Silvester feiern?</strong></p><p><strong>Antwort: </strong>Auch den Jahreswechsel wird man nur in einem kleineren Kreis feiern können, als bisher gedacht. Für die Nacht von 31. Dezember auf den 1. Jänner gilt: Es entfallen die nächtlichen Ausgangsbeschränkungen. Das heißt, wann man in der Nacht nach einer Einladung nach Hause fährt, ist egal. Jedoch bleiben die Kontaktbeschränkungen aufrecht. Das bedeutet, dass sich – wie an allen anderen Tagen auch – maximal zwei Haushalte in der Größe von insgesamt sechs Erwachsenen plus sechs Kindern zum Anstoßen auf das neue Jahr treffen können.</p><p><strong>Frage: Wann kann man sich vor Weihnachten – im Zuge der Massentests – noch testen lassen?</strong></p><p><strong>Antwort: </strong>Tirol und Vorarlberg haben die Massentestungen bereits abgeschlossen. In allen anderen Bundesländern kann man sich noch auf das Coronavirus testen lassen. In Wien, Kärnten, Salzburg, Niederösterreich und der Steiermark ist das noch bis Sonntag, 13. Dezember möglich. In Oberösterreich hat man bis bis Montag, den 14. Dezember, Zeit. Im Burgenland ist ein Test bis Dienstag, den 15. Dezember, möglich.</p><p><strong>Frage: Gibt es einen zweiten Massentest-Termin? </strong></p><p><strong>Antwort: </strong>Ja. Geplant ist ein zweiter Durchlauf Anfang Jänner. In den meisten Bundesländern soll die Testung von 8. bis 10. Jänner über die Bühne gehen. Wien wird wegen seiner hohen Bevölkerungszahl etwas länger brauchen und die Test-Dauer darum bis zum 17. Jänner ausdehnen.</p><p><strong>Frage: Gibt es sonst noch andere Möglichkeiten zum Test vor dem Fest?</strong></p><p><strong>Antwort: </strong>Ja. Wenn man Symptome hat, kann man in jedem Bundesland weiterhin 1450 anrufen und wird auf das Corona-Virus getestet. Hat man keine Symptome gibt es mittlerweile diverse Möglichkeiten für einen Schnelltest. Beispielsweise in der Apotheke. Dieser kostet rund 30 Euro und dauern nur eine halbe Stunde, bis das Ergebnis vorliegt. Auch sonst gibt es eine große Bandbreite an Schnelltests, <a href=""/2000122437708"">DER STANDARD hat einige davon getestet.</a> In Wien gibt es zudem drei gratis Teststraßen der Stadt. Die Teststraße beim Ernst-Happel-Stadion, jene auf der Donauinsel und seit neuem auch die Teststraße im Austria Center Vienna. In letzterer kommen Antigen-Schnelltests zum Einsatz. Bei den anderen beiden muss man gurgeln.</p><p><strong>Frage: Gibt es Testungen für bestimmte Berufsgruppen?</strong></p><p><strong>Antwort: </strong>Ja.  Ausgeweitet sollen auch die regelmäßigen Zielgruppen-Testungen werden. So soll künftig nicht nur medizinisches Personal, sondern auch Menschen in körpernahen Dienstleistungen und Berufsgruppen mit viel Kundenkontakt sowie Pädagoginnen und Pädagogen regelmäßig getestet werden. Und zwar verpflichtend: Ab 8. Jänner sollen sie sich alle zwei Wochen auf Covid-19 testen lassen müssen. Es gebe sehr viele Menschen, die jetzt schon einmal die Woche getestet werden, erklärte Kanzler Kurz Freitagnacht. Dies werde auf weitere Gruppen ausgeweitet – welche, das wird noch definiert. Es sollen aber nicht nur Lehrerinnen und Lehrer und körpernah Tätige sein.</p><p><strong>Frage: Und was ist mit besonders stark betroffenen Regionen?</strong></p><p><strong>Antwort: </strong>In besonders betroffenen Regionen, für die wird noch ein Inzidenzwert definiert werden soll, wird eine Massentestung vorgenommen werden. Diese kann die Quarantäne ersetzen.</p><p><strong>Frage: Soll die Maskenpflicht ausgeweitet werden?</strong></p><p><strong>Antwort:</strong> Die Bundesländer erhalten künftig die Möglichkeit, eine Maskenpflicht in stark frequentierten Zonen auch im Freien einzuführen. Die Plätze sollen die Länder selbst bestimmen können, etwa gutbesuchte Einkaufsstraßen. Aber etwa auch bei Märkten oder in manchen Erholungsgebieten in den Städten, kann sich die Regierung eine Maskenpflicht vorstellen.</p><p><strong>Frage: Wie sieht es mit dem Mund-Nasen-Schutz am Arbeitsplatz aus?</strong></p><p>Antwort: Diejenigen, die eine Möglichkeit dazu haben, sollen weiterhin im Home Office arbeiten. Für alle, die an ihren Arbeitsplatz müssen, soll künftig dort die Maskenpflicht eingeführt werden. Jedoch nur dort, wo der Mindestabstand nicht eingehalten werden kann. (ook, 12.12.2020)</p><p>Egal ob man Silvester-Fan ist oder nicht, der heurige Jahreswechsel wird ein sehr spezieller.</p>Foto: APA/HERBERT P. OCZERET",0.0018275117370892017,0.0
2000122440975,/jetzt/livebericht/2000122440975/maskenpflicht-im-freien-und-am-arbeitsplatz-silvesterfeiern-mit-maximal-zwei,(keine Angabe),Coronavirus,Redaktion,Online only,LiveBericht,2020-12-12 07:21:48.450,"Geringe Testbeteiligung in Wien zeichnet sich ab, USA starten ab Montag mit Impfungen","﻿2.0Tagesüberblick CoronavirusGeringe Testbeteiligung in Wien zeichnet sich ab, USA starten ab Montag mit ImpfungenTagesueberblick-Coronavirus-Geringe-Testbeteiligung-in-Wien-zeichnet-sich-ab-USA-starten-ab-Montag-mit-ImpfungenDie österreichische Regierung denkt offenbar über ein Anreizsystem nach, um Menschen zur Teilnahme an den Massentests zu bewegen. Die wichtigsten Corona-News des Tages<h3>Das Wichtigste in Kürze:</h3><ul><li>In <strong>Österreich</strong> sind in den vergangenen 24 Stunden <a href=""/jetzt/livebericht/2000122440975/1000211913/maskenpflicht-im-freien-und-am-arbeitsplatz-silvesterfeiern-mit-maximal-zwei""><strong>3.241 Neuinfektionen mit dem Virus</strong></a> registriert worden. Die Zahl der Todesfälle stieg um 126.</li><li>Bei der Übermittlung der <strong>Massentest-Ergebnisse </strong><a href=""/jetzt/livebericht/2000122440975/1000211944/maskenpflicht-im-freien-und-am-arbeitsplatz-silvesterfeiern-mit-maximal-zwei"">kam es am Samstag zu </a><a><strong>Verzögerungen</strong></a>. Das System musste laut Meldungen wegen Teil-Überlastung vorerst heruntergefahren werden.</li><li>In <strong>Deutschland </strong>zeichnet sind in den Vorgesprächen zwischen Bund und Ländern <a href=""/story/2000122451972/harter-lockdown-in-deutschland-steht-bevor-details-sind-aber-noch"">offenbar ein </a><a><strong>harter Lockdown ab Mittwoch</strong> ab.</a></li><li><strong>Wien </strong>geht am Sonntag in den letzten Tag der Massentests. <a href=""/jetzt/livebericht/2000122440975/1000211956/maskenpflicht-im-freien-und-am-arbeitsplatz-silvesterfeiern-mit-maximal-zwei"">Bisher dürfte die Beteiligung nur um die</a><a><strong> zehn Prozent </strong>liegen</a>.</li><li>Laut Medienberichten überlegt die Regierung, ein <strong>Anreizsystem für die Massentests</strong> zu schaffen, um im Jänner die <a href=""/jetzt/livebericht/2000122440975/1000211945/maskenpflicht-im-freien-und-am-arbeitsplatz-silvesterfeiern-mit-maximal-zwei"">Teilnehmerzahl zu steigern</a>.</li><li>Die Regierung hat sich mit den Bundesländern auf neue <b>Regeln für die Weihnachtsfeiertage und Silvester</b> verständigt, zudem kommt eine <b>Maskenpflicht an stark frequentierten Orten im Freien und am Arbeitsplatz, wo Abstandsregeln nicht eingehalten werden können</b>. Von 8. bis 10. Jänner ist ein <b>zweite Runde für Massentests</b> vorgesehen, in Wien von 8. bis 17. Jänner. Für <b>manche Berufsgruppen</b>, wie Lehrer oder körpernahe Dienstleister, wird es <b>verpflichtende Tests</b> geben.<br></li><li>Die <strong>Reproduktionszahl </strong>in Österreich ist mit Stand Freitag <a href=""/jetzt/livebericht/2000122402488/1000211860/massentests-in-salzburg-oberoesterreich-und-kaernten-startenerweiterte-registrierungspflicht-geplant-wirbel"">leicht </a><a><strong>auf 0,79 gesunken</strong></a>. Vergangene Woche war sie bei 0,82 gelegen.</li><li>In den <strong>USA </strong>soll ab Montag mit den Corona-<strong>Impfungen </strong><a href=""/jetzt/livebericht/2000122440975/1000211951/maskenpflicht-im-freien-und-am-arbeitsplatz-silvesterfeiern-mit-maximal-zwei"">begonnen werden</a>.</li><li>Die US-Arzneimittelbehörde FDA hat dem <a href=""/jetzt/livebericht/2000122440975/1000211897/maskenpflicht-im-freien-und-am-arbeitsplatz-silvesterfeiern-mit-maximal-zwei""><strong>Impfstoff von Biontech eine Notfallzulassung</strong></a> erteilt.<br></li><li>Deutschland meldet <a href=""/jetzt/livebericht/2000122440975/1000211896/maskenpflicht-im-freien-und-am-arbeitsplatz-silvesterfeiern-mit-maximal-zwei"">mehr als 28.000 Neuinfektionen</a>. (red, 12.12.2020) </li></ul><h3>Mehr zum Thema:</h3><ul><li><a href=""/story/2000120397677/wie-sich-die-symptome-von-covid-19-grippe-und-grippalem"">Wie sich die Symptome von Covid-19, Grippe und grippalem Infekt unterscheiden</a></li><li><a href=""/story/2000120485953/stimmen-aus-dem-forum-corona-erfahrungen-der-standard-community"">Die STANDARD-Community erzählt von ihren Corona-Krankheitserfahrungen</a></li><li><a href=""/story/2000120105512/betroffene-erzaehlen-so-haben-wir-covid-19-ueberstanden"">Betroffene erzählen: So haben wir Covid-19 überstanden</a></li></ul>Foto: APA/Erwin ScheriauFoto: APA/Herbert OczeretFoto: APA / Hanz PunkzFoto: APA/ROBERT JAEGERFoto:  APA/HERBERT P. OCZERETFoto: AFP / THOMAS SAMSONFoto: AFP / Go NakamuraFoto: REUTERS/Radovan Stoklasa/File PhotoFoto: APA/ERWIN SCHERIAUFoto: APA / AFP / Tobias SchwarzFoto: AFP/ANDY STENNINGFoto: APA/HELMUT FOHRINGERFoto: reutersFoto: AFP/Owen HumphreysFoto: EPA/Dominic LipinskiFoto: APA / BARBARA GINDLFoto: APA / HERBERT NEUBAUERFoto: APA/HERBERT NEUBAUERFoto: APA/BARBARA GINDL",0.0004282571912013536,-0.04729285714285714
2000122479006,/2000122479006/15-Jaehrige-klagt-Republik-wegen-Maskenpflicht-an-Schulen,(keine Angabe),Coronavirus,APA,Agentur,Artikel,2020-12-14 12:40:22.000,15-Jährige klagt Republik wegen Maskenpflicht an Schulen,"﻿2.0Corona-Regeln15-Jährige klagt Republik wegen Maskenpflicht an SchulenCorona-Regeln-15-Jaehrige-klagt-Republik-wegen-Maskenpflicht-an-SchulenDie ""Initiative für evidenzbasierte Coronainformation"" unterstützt die Klage der Gymnasiastin aus der Obersteiermark<p>Wien – Eine 15-jährige Gymnasiastin aus der Obersteiermark hat wegen der Maskenpflicht im Unterricht Klage gegen die Republik eingebracht, hieß es am Montag in einer Aussendung der ""Initiative für eine evidenzbasierte Coronainformation"", die die Musterklage unterstützt. Ihr Argument: Es fehle Evidenz, dass Maskentragen eine Ansteckung mit Covid-19 verhindern kann, gleichzeitig könnten psychische und physische Beeinträchtigungen beim dauerhaften Tragen nicht ausgeschlossen werden.</p><p>Die Anwältin der Schülerin, Michaela Hämmerle, bemängelt in der Klage die fehlende Verhältnismäßigkeitsprüfung und die Verletzung von Rechtsgütern wie Leben und Gesundheit, da gravierende Folgen für die Psyche von Kindern und Jugendlichen nicht ausgeschlossen werden könnten. Hämmerle verweist zudem auf eine dänische Studie, wonach Maskentragen keinen signifikanten Schutz vor einer Infektion biete.</p><h3>Corona-Skeptiker unterstützen Klage</h3><p>Die Schülerin verlangt laut Aussendung in ihrer Klage von der Republik die Feststellung, dass sie keinen Mund-Nasen-Schutz tragen muss. Andernfalls will sie, dass der Bund als Verordnungsgeber die Haftung für sämtliche Folgeschäden, die durch das Maskentragen auftreten, übernehmen muss.</p><p>Die ""Initiative für eine evidenzbasierte Coronainformation"" (ICI) hat in der Vergangenheit mehrfach Demonstrationen von Corona-Skeptikern organisiert, <a href=""/story/2000117230707/social-distancing-als-folter-corona-skeptiker-protestierten-erneut""> Social Distancing als ""Folter"" bezeichnete und das Tragen von Masken ohne wissenschaftliche Evidenz als ""gefährlich"" eingestuft</a>. Sie ist außerdem Initiatorin des Volksbegehrens für ein ""Wiedergutmachungsgesetz zu den Covid-19-Maßnahmen"". Für den Fall, dass die Musterklage der Schülerin erfolgreich sein sollte, plant die ICI laut Aussendung das Führen großer Sammelverfahren. (APA, red, 14.12.2020)</p><p><strong>Zum Weiterlesen:</strong></p><p><a href=""/story/2000117230707/social-distancing-als-folter-corona-skeptiker-protestierten-erneut"">Social Distancing als ""Folter"": Corona-Skeptiker protestierten erneut</a></p><p><a href=""/story/2000120443441/berufsverbot-fuer-arzt-in-bad-aussee-wegen-online-attesten-fuer"">Berufsverbot für Arzt in Bad Aussee wegen Online-Attesten für Maskenverweigerer</a></p><p><a href=""/story/2000120987817/warum-uns-aengste-oft-in-die-irre-fuehren"">Warum uns Ängste oft in die Irre führen</a></p><p>Das Tragen von Masken verursacht in den Augen der Klägerin gesundheitliche Schäden.</p>Foto: imago images / Michael Weber",-0.007999721448467967,-0.05092857142857143
2000122526777,/jetzt/livebericht/2000122526777/in-usa-laufen-erste-corona-impfungen-an-14-432-neuinfektionen,(keine Angabe),Coronavirus,Redaktion,Online only,LiveBericht,2020-12-16 05:49:52.340,"Kanzler Kurz: Österreich erhält bis März rund 900.000 Biontech-Impfdosen, Impfstart noch 2020","﻿2.0Tagesüberblick CoronavirusKanzler Kurz: Österreich erhält bis März rund 900.000 Biontech-Impfdosen, Impfstart noch 2020Tagesueberblick-Coronavirus-Kanzler-Kurz-Oesterreich-erhaelt-bis-Maerz-rund-900000-Biontech-Impfdosen-Impfstart-noch-2020Erste Impfungen sind in Wien und Niederösterreich geplant. In Deutschland sollen die Impfungen am 27. Dezember beginnen. Die Corona-News im Überblick<h3>Das Wichtigste in Kürze:</h3><ul><li>Von Dienstag auf Mittwoch wurden in<strong> </strong><a href=""/jetzt/livebericht/2000122526777/1000212264/in-usa-laufen-erste-corona-impfungen-an-14-432-neuinfektionen""><strong>Österreich 2.664 Corona-Neuinfektionen</strong></a> gemeldet. Innerhalb der vergangenen 24 Stunden <strong>verstarben 116 Personen</strong> mit oder wegen des Virus.</li><li>Laut Bundeskanzler <strong>Sebastian Kurz (ÖVP)</strong> soll <strong>Österreich </strong><a href=""/jetzt/livebericht/2000122526777/1000212283/in-usa-laufen-erste-corona-impfungen-an-14-432-neuinfektionen?isadminview=true&amp;responsive=false""><strong>bis März 900.000 Impfdosen</strong> von Biontech/Pfizer erhalten</a>.<a href=""/jetzt/livebericht/2000122526777/1000212267/in-usa-laufen-erste-corona-impfungen-an-14-432-neuinfektionen?isadminview=true&amp;responsive=false""><b> </b></a><a href=""/jetzt/livebericht/2000122526777/1000212251/in-usa-laufen-erste-corona-impfungen-an-14-432-neuinfektionen""><b>Erste Impfungen</b> soll es in <b>Österreich</b> in Wien und Teilen Niederösterreichs</a> noch in <b>diesem Jahr </b>geben. Grund sind logistische Fragen, da der Pharmakonzern Pfizer die ersten Dosen nur nach Wien liefern könne. <a href=""/jetzt/livebericht/2000122526777/1000212267/in-usa-laufen-erste-corona-impfungen-an-14-432-neuinfektionen?isadminview=true&amp;responsive=false"">Laut <b>Gallup-Umfrage</b> ist die <b>Bereitschaft</b> in Österreich, sich <b>impfen</b> zu lassen, zuletzt <b>gesunken</b>.</a><br></li><li><strong>Deutschland</strong> meldete am Mittwoch <a href=""/jetzt/livebericht/2000122526777/1000212243/in-usa-laufen-erste-corona-impfungen-an-14-432-neuinfektionen""><strong>952 Todesfälle</strong> in Verbindung mit dem Coronavirus</a>. Das ist ein <strong>neuer Rekord.</strong> In den vergangenen 24 Stunden wurden <strong>27.728 Neuinfektionen</strong> registriert. Heute beginnt in <a href=""/jetzt/livebericht/2000122526777/1000212242/in-usa-laufen-erste-corona-impfungen-an-14-432-neuinfektionen"">Deutschland der <b>harte Lockdown</b></a>.<br><strong> </strong></li><li><a href=""/story/2000122510259/corona-verordnungen-und-antiterrorpaket-am-mittwoch-im-parlament"">Am 19. Dezember tritt die neue Einreiseverordnung für Österreich in Kraft</a>. Sie führt zu Restriktionen und sieht Quarantänepflichten vor.</li><li>Im Hauptausschuss des Nationalrats ist die <a href=""/jetzt/livebericht/2000122526777/1000212284/in-usa-laufen-erste-corona-impfungen-an-14-432-neuinfektionen""><strong>Weihnachtsverordnung</strong></a><a><strong> </strong></a>am Mittwoch laut Parlamentskorrespondenz mit Stimmen von ÖVP, Grünen und der SPÖ <strong>beschlossen </strong>worden. Neu ist nun, dass ab <strong>24. Dezember ein Zoobesuch wieder möglich</strong> sein wird. Auch<strong> Skilifte dürfen an diesem Tag den Betrieb wiederaufnehmen.</strong> An den ersten beiden Weihnachtstagen (24. und 25.) gilt keine Maskenpflicht bei den Festen mit Familie oder Freunden. Dies gilt auch für den erweiterten privaten Wohnbereich (zum Beispiel Scheunen, Garagen). (red, 16.12.2020)  <br></li></ul><h3>Mehr zum Thema:</h3><ul><li><a href=""/story/2000120397677/wie-sich-die-symptome-von-covid-19-grippe-und-grippalem"">Wie sich die Symptome von Covid-19, Grippe und grippalem Infekt unterscheiden</a></li><li><a href=""/story/2000120485953/stimmen-aus-dem-forum-corona-erfahrungen-der-standard-community"">Die STANDARD-Community erzählt von ihren Corona-Krankheitserfahrungen</a></li><li><a href=""/story/2000120105512/betroffene-erzaehlen-so-haben-wir-covid-19-ueberstanden"">Betroffene erzählen: So haben wir Covid-19 überstanden</a></li></ul>Foto: AFP/Steve ParsonsFoto: AP/Domenico StinellisFoto: imago images/IPA PhotoFoto: REUTERS/Carlos OsorioFoto: Mark Lennihan/Pool via REUTERSFoto: ReutersFoto: APA/GERD EGGENBERGERFoto: AP / Manu FernandezFoto: imago images/Christian GrubeFoto: APA / Erwin ScheriauFoto: ReutersFoto: APA/Erwin ScheriauFoto: APA/Herbert OczeretFoto: APA / Hanz PunkzFoto: APA/ROBERT JAEGERFoto:  APA/HERBERT P. OCZERETFoto: AFP / THOMAS SAMSONFoto: AFP / Go NakamuraFoto: REUTERS/Radovan Stoklasa/File PhotoFoto: APA/ERWIN SCHERIAUFoto: APA / AFP / Tobias SchwarzFoto: AFP/ANDY STENNINGFoto: APA/HELMUT FOHRINGERFoto: reutersFoto: AFP/Owen HumphreysFoto: EPA/Dominic LipinskiFoto: APA / BARBARA GINDLFoto: APA / HERBERT NEUBAUERFoto: APA/HERBERT NEUBAUERFoto: APA/BARBARA GINDL",0.00017389380530973456,0.00028571428571428574
2000122568683,/jetzt/livebericht/2000122568683/in-usa-laufen-erste-corona-impfungen-an-14-432-neuinfektionen,(keine Angabe),Coronavirus,Redaktion,Online only,LiveBericht,2020-12-17 05:40:57.240,Regierung und Landeshauptleute beraten am Freitag über Corona-Maßnahmen,"﻿2.0Tagesüberblick CoronavirusRegierung und Landeshauptleute beraten am Freitag über Corona-MaßnahmenTagesueberblick-Coronavirus-Regierung-und-Landeshauptleute-beraten-am-Freitag-ueber-Corona-Massnahmen218 Todesfälle in Österreich gemeldet. Erste Impfungen in Österreich am 27. Dezember geplant. Die Corona-News im Überblick<h3>Das Wichtigste in Kürze:</h3><ul><li>Mehrere Medien berichteten am Donnerstag von Regierungsplänen, die einen Lockdown nach Weihnachten vorsehen. <a href=""/jetzt/livebericht/2000122568683/1000212464/in-usa-laufen-erste-corona-impfungen-an-14-432-neuinfektionen?isadminview=true&amp;responsive=false"">DER STANDARD konnte in Erfahrung bringen</a>, dass es am <strong>Freitag</strong> eine <strong>Sitzung mit Experten und Landeshauptleuten zur Corona-Lage </strong>gibt. Danach ist auch ein Pressestatement geplant.</li><li><a href=""/jetzt/livebericht/2000122568683/1000212396/in-usa-laufen-erste-corona-impfungen-an-14-432-neuinfektionen""><strong>Österreich</strong> hat am Donnerstag <strong>218 neue Corona-Todesfälle </strong>gemeldet.</a> Allerdings: Mehr als die Hälfte davon stammt aus <strong>Nachmeldungen in Wien.</strong> Es gab<strong> 2.485 Neuinfektionen.</strong></li><li><a href=""/story/2000122585598/eu-weiter-impfstart-laut-von-der-leyen-am-27-dezember""><strong>EU</strong>-Kommissionspräsidentin Ursula <strong>von der Leyen</strong> teilte mit</a>, dass die <strong>Impfungen EU-weit mit 27. Dezember starten.</strong> Bundeskanzler Sebastian <strong>Kurz</strong> (ÖVP) <a href=""/jetzt/livebericht/2000122568683/1000212445/in-usa-laufen-erste-corona-impfungen-an-14-432-neuinfektionen?isadminview=true&amp;responsive=false""><strong>bestätigte</strong> diesen <strong>Starttermin</strong> auch <strong>für Österreich</strong>. </a><a><br></a></li><li><strong>Frankreichs Präsident </strong>Emmanuel <strong>Macron </strong><a href=""/story/2000122579235/frankreichs-praesident-macron-positiv-auf-coronavirus-getestet"">wurde <strong>positiv</strong> auf das Coronavirus getestet.</a></li><li><strong>Österreich soll </strong><a href=""/jetzt/livebericht/2000122526777/1000212283/in-usa-laufen-erste-corona-impfungen-an-14-432-neuinfektionen?isadminview=true&amp;responsive=false""><strong>bis März 900.000 Impfdosen</strong> von Biontech/Pfizer erhalten</a>.<a href=""/jetzt/livebericht/2000122526777/1000212267/in-usa-laufen-erste-corona-impfungen-an-14-432-neuinfektionen?isadminview=true&amp;responsive=false""><b> </b></a><br></li><li><a href=""/story/2000122510259/corona-verordnungen-und-antiterrorpaket-am-mittwoch-im-parlament"">Am<strong> Samstag</strong> tritt die <strong>neue Einreiseverordnung</strong> für Österreich in Kraft</a>. Sie führt zu Restriktionen und sieht Quarantänepflichten vor.</li><li>Am Mittwoch wurde die <a href=""/jetzt/livebericht/2000122526777/1000212284/in-usa-laufen-erste-corona-impfungen-an-14-432-neuinfektionen""><strong>Weihnachtsverordnung</strong></a><a><strong> </strong></a><strong>beschlossen.</strong> Neu ist, dass <strong>ab 24. Dezember </strong>ein <strong>Zoobesuch wieder möglich</strong> sein wird. Auch<strong> Skilifte dürfen an diesem Tag den Betrieb aufnehmen.</strong> An den ersten beiden Weihnachtstagen (24. und 25.) gilt keine Maskenpflicht bei Festen mit Familie oder Freunden. Das gilt auch für den erweiterten privaten Wohnbereich, etwa Scheunen oder Garagen. (red, 17.12.2020)<br></li></ul><h3>Mehr zum Thema:</h3><ul><li><a href=""/story/2000120397677/wie-sich-die-symptome-von-covid-19-grippe-und-grippalem"">Wie sich die Symptome von Covid-19, Grippe und grippalem Infekt unterscheiden</a></li><li><a href=""/story/2000120485953/stimmen-aus-dem-forum-corona-erfahrungen-der-standard-community"">Die STANDARD-Community erzählt von ihren Corona-Krankheitserfahrungen</a></li><li><a href=""/story/2000120105512/betroffene-erzaehlen-so-haben-wir-covid-19-ueberstanden"">Betroffene erzählen: So haben wir Covid-19 überstanden</a></li></ul>Foto: imago images/FrankHoermann/SVEN SIMON Foto: Lisa Ferdinando/imago images/ZUMA WireFoto: Erin Clark/Pool via REUTERSFoto: AFP/Steve ParsonsFoto: AP/Domenico StinellisFoto: imago images/IPA PhotoFoto: REUTERS/Carlos OsorioFoto: Mark Lennihan/Pool via REUTERSFoto: ReutersFoto: APA/GERD EGGENBERGERFoto: AP / Manu FernandezFoto: imago images/Christian GrubeFoto: APA / Erwin ScheriauFoto: ReutersFoto: APA/Erwin ScheriauFoto: APA/Herbert OczeretFoto: APA / Hanz PunkzFoto: APA/ROBERT JAEGERFoto:  APA/HERBERT P. OCZERETFoto: AFP / THOMAS SAMSONFoto: AFP / Go NakamuraFoto: REUTERS/Radovan Stoklasa/File PhotoFoto: APA/ERWIN SCHERIAUFoto: APA / AFP / Tobias SchwarzFoto: AFP/ANDY STENNINGFoto: APA/HELMUT FOHRINGERFoto: reutersFoto: AFP/Owen HumphreysFoto: EPA/Dominic LipinskiFoto: APA / BARBARA GINDLFoto: APA / HERBERT NEUBAUERFoto: APA/HERBERT NEUBAUERFoto: APA/BARBARA GINDL",0.00039969879518072284,0.0
